"8f4e6cf1-4941-43e8-be9c-ca1989d23b04","4511395_2","Einhell Power X Change 18v Lithium Ion 2.0ah Battery Twin Pack PX-BAT2 Ozito x 2","","58.99","","","","","","","55.50","","","","","","","","","","39.99","39.99","","","38.99","120.50","9.95","Einhell Power X Change 18v Lithium Ion 2.0ah Battery (TWIN PACK)<br><br>Power X-Change is the rechargeable battery system from Einhell. It is designed for multi functionality. With this advanced technology, you can use 18V rechargeable batteries with different capacity ratings to power any of the Einhell Power X Change range.<br><br>7-in-1 ABS: Active Battery Management System from Einhell.<br><br>No memory effect - the battery can be recharged at any time, even if it is only partially discharged.<br><br>No self discharging - always ready for immediate action even after being in storage for months.<br><br>Compact and light - significantly lighter than NiCd batteries allowing better handling.<br><br>Sophisticated charging technology - short charging time, optimum performance and maximum battery life.<br><br>Consistently high performance - delivers almost the same power at the end of the battery life as freshly charged ones.<br><br>3 x running time - compared to the conventional NiCd batteries.<br><br>3-step LED battery control.<br><br>Modern technology: Microprocessor controls permanently parameters.<br><br>Rubber-coated housing makes sure high impact protection and grip.<br><br>","<b>Specifications of the Einhell Power X Change 18v Lithium Ion 2.0ah Battery</b><br><br>Voltage: 18V.<br>Battery Type: Lithium-Ion.<br>Power: 2.0 Amp Hours.<br>Charge time: 40 Minutes.<br><br>","<img src=""https://shared1.ad-lister.co.uk/UserImages/fad77979-26e2-4ede-9f39-bdb242f0c51d/Img/_brandlogos/einhell_brandlogo.jpg""><br>","","","Einhell Power X Change 18v Lithium Ion 2.0ah Battery (TWIN PACK) Power X-Change is the rechargeable battery system from Einhell. It is designed for multi functionality. With this advanced technology, you can use 18V rechargeable batteries with different capacity ratings to power any of the Einhell Power X Change range. 7-in-1 ABS: Active Battery Management System from Einhell. No memory effect - the battery can be recharged at any time, even if it is only partially discharged. No self discharging - always ready for immediate action even after being in storage for months. Compact and light - significantly lighter than NiCd batteries allowing better handling. Sophisticated charging technology - short charging time, optimum performance and maximum battery life. Consistently high ...","https://shared1.ad-lister.co.uk/UserImages/fad77979-26e2-4ede-9f39-bdb242f0c51d/Img/2024_02/4511395_2.jpg","https://shared1.ad-lister.co.uk/UserImages/fad77979-26e2-4ede-9f39-bdb242f0c51d/Img/2024_02/4511395-MAIN.jpg","https://shared1.ad-lister.co.uk/userimages/fad77979-26e2-4ede-9f39-bdb242f0c51d/img/2022_3/pxc-family.jpg","https://shared1.ad-lister.co.uk/UserImages/fad77979-26e2-4ede-9f39-bdb242f0c51d/Img/2024_01/4512097-6.jpg","https://shared1.ad-lister.co.uk/UserImages/fad77979-26e2-4ede-9f39-bdb242f0c51d/Img/2024_01/4512097-9.jpg","https://shared1.ad-lister.co.uk/UserImages/fad77979-26e2-4ede-9f39-bdb242f0c51d/Img/2024_01/4512097-11.jpg","https://shared1.ad-lister.co.uk/UserImages/fad77979-26e2-4ede-9f39-bdb242f0c51d/Img/2024_02/4512097-2.jpg","https://shared1.ad-lister.co.uk/UserImages/fad77979-26e2-4ede-9f39-bdb242f0c51d/Img/2024_02/4512097-4.jpg","https://shared1.ad-lister.co.uk/UserImages/fad77979-26e2-4ede-9f39-bdb242f0c51d/Img/2024_01/4512097-10.jpg","https://shared1.ad-lister.co.uk/UserImages/fad77979-26e2-4ede-9f39-bdb242f0c51d/Img/2024_01/4512097-5.jpg","","","","","","","","","","","","","","","8"
"e8c8d593-edce-4c96-836f-cb4e3d138489","4430840-DBSET","Einhell TE-AG230 Angle Grinder 9"" 230mm 2000W 240V TE-AG Soft Start + 2 x Blades","3 Position Handle | Quick Adjustment Guard | Trade","89.99","","","","","","","84.99","","","","","","","","","","84.99","84.99","","","79.99","","","<div><strong>Desciption For 4430840</strong><br><br>The Einhell TE-AG230 Angle Grinder is an affordable performance-driven DIY tool. The soft start facility ensures this powerful angle grinder provides a comfortable start-up for users, which eases into a robust and powerful grinding performance over a short period of time. This provides added safety and comfort for users.<br><br>The angle grinder TE-AG 230/2000 is a robust and powerful tool for real experts with exacting demands, which offers outstanding performance on challenging cutting, grinding and roughing jobs everywhere in the home, workshop and garage.<br><br>Its disk guard with quick-adjust facility can be adapted with just a twist of the hand to any task, while the spindle lock permits easy and speedy tool change. A soft start function ensures that the tool starts up smoothly and safely. The TE-AG 230/2000 is equipped with a long-lasting, robust metal gear head which ensures optimum power transmission and low-vibration running.<br>Thanks to the soft grip on both the main handle and the additional handle, the angle grinder offers comfortable handling of the tool. The additional handle can be secured in three different positions for exact adaptation to the particular workpiece, thus ensuring a perfect hold for safe and speedy operation. The cable clip for securing the wound-up cable with just a twist of the hand keeps the TE-AG 230/2000 neat and safe when stored away.<br>Suitable for the more difficult tasks, due to its powerful metal gearing system. Further benefits include the keyless disc guard adjustment for quick adjustment depending on the job, spindle lock and the 3-postitional front handle.<br><br>Features<br><br>Ergonomic plastic housing with soft grip and robust, long-lasting aluminium transmission head for the demanding building site use<br>Powerful 2,00 Watt performance with a constant speed of 6,500 revolutions per minute<br>Additional handle with soft grip for each task mountable in 3 positions<br>Practical spindle lock for a quick tool change and simple adjustment of the disk guard without tools<br>Innovative cable clip for fixing the wound cable</div><div>&nbsp;</div><div><strong>Desciption For 49797605</strong><br><br>Original Einhell 2-piece 230 mm diamond cutting disc set<br>Compatible with angle grinders with Ø 230 mm<br>Compatible with Einhell angle grinder TE-AG 230<br>Compatible with Einhell angle grinder TE-AG 230/2000<br>Dimensions Ø 230 x 1.8 mm and 22-mm bore<br>Extra thin diamond cutting discs for little material loss<br>Suitable for cutting tiles or travertin<br>Suitable for higher cutting performance in granite or concrete for example<br>Maximum revs per minute: 6,600 min^-1<br>Can be used with a circumferential speed of 80 m/s<br><br>Incl. 1x cutting disc with diamond sprinkled turbo edge<br>Incl. 1x cutting disc with diamond sprinkled segmented edge</div>","<div><strong>Specifications For 4430840&nbsp;</strong><br><br>EAN<span style=""white-space:pre"">	</span>4006825593419<br>MPN<span style=""white-space:pre"">	</span>4430840<br>Range<span style=""white-space:pre"">	</span>Einhell Expert<br>Length<span style=""white-space:pre"">	</span>540<br>Width<span style=""white-space:pre"">	</span>140<br>Height<span style=""white-space:pre"">	</span>160<br>Volume in m^3<span style=""white-space:pre"">	</span>0.0121<br>Gross Weight<span style=""white-space:pre"">	</span>6.26<br>Power Source<span style=""white-space:pre"">	</span>electric<br>Model<span style=""white-space:pre"">	</span>TE-AG 230/2000<br>Brand<span style=""white-space:pre"">	</span>Einhell</div><div>&nbsp;</div><div><strong>Specifications For 49797605</strong><br><br>Manufacturer - ‎kwb by Einhell<br>Part Number - ‎49797605<br>Package Dimensions - ‎26 x 23.3 x 1.3 cm; 1.16 Kilograms<br>Item model number - ‎49797605<br>Style - Industrial<br>Material - ‎Diamond<br>Thickness - ‎3.3 Millimetres<br>Item Package Quantity - ‎1<br>Number of Pieces - ‎2<br>Included Components - ‎2 x cutting discs.<br>Item Weight - 1.16 kg</div>","<img src=""https://shared1.ad-lister.co.uk/UserImages/fad77979-26e2-4ede-9f39-bdb242f0c51d/Img/_brandlogos/Einhell_brandlogo.jpg""><br>","<img src=""https://shared1.ad-lister.co.uk/UserImages/fad77979-26e2-4ede-9f39-bdb242f0c51d/Img/_authdealerlogo/einhell_auth.jpg""><br>","","Desciption For 4430840  The Einhell TE-AG230 Angle Grinder is an affordable performance-driven DIY tool. The soft start facility ensures this powerful angle grinder provides a comfortable start-up for users, which eases into a robust and powerful grinding performance over a short period of time. This provides added safety and comfort for users. ​ The angle grinder TE-AG 230/2000 is a robust and powerful tool for real experts with exacting demands, which offers outstanding performance on challenging cutting, grinding and roughing jobs everywhere in the home, workshop and garage.  Its disk guard with quick-adjust facility can be adapted with just a twist of the hand to any task, while the spindle lock permits easy and speedy tool change. A soft start function ensures that the tool starts up smoothly and safely. The TE-AG 230/2000 is equipped with a long-lasting, robust metal gear head which ensures optimum power transmission and low-vibration running. Thanks to the soft grip on both the main handle and the additional handle, the angle grinder offers comfortable handling of the tool. The additional handle can be secured in three different positions for exact adaptation to the particular workpiece, thus ensuring a perfect hold for safe and speedy operation. The cable clip for securing the wound-up cable with just a twist of the hand keeps the TE-AG 230/2000 neat and safe when stored away. Suitable for the more difficult tasks, due to its powerful metal gearing system. Further benefits include the keyless disc guard adjustment for quick adjustment depending on the job, spindle lock and the 3-postitional front handle.  Features ​ Ergonomic plastic housing with soft grip and robust, long-lasting aluminium transmission head for the demanding building site use Powerful 2,00 Watt performance with a constant speed of 6,500 revolutions per minute Additional handle with soft grip for each task mountable in 3 positions Practical spindle lock for a quick tool change and simple adjustment of the disk guard without tools Innovative cable clip for fixing the wound cable  Desciption For 49797605  Original Einhell 2-piece 230 mm diamond cutting disc set Compatible with angle grinders with Ø 230 mm Compatible with Einhell angle grinder TE-AG 230 Compatible with Einhell angle grinder TE-AG 230/2000 Dimensions Ø 230 x 1.8 mm and 22-mm bore Extra thin diamond cutting discs for little material loss Suitable for cutting tiles or travertin Suitable for higher cutting performance in granite or concrete for example Maximum revs per minute: 6,600 min^-1 Can be used with a circumferential speed of 80 m/s ​ Incl. 1x cutting disc with diamond sprinkled turbo edge Incl. 1x cutting disc with diamond sprinkled segmented edge","https://shared1.ad-lister.co.uk/UserImages/fad77979-26e2-4ede-9f39-bdb242f0c51d/Img/2024_02/4430840-DBSET2.jpg","https://shared1.ad-lister.co.uk/UserImages/fad77979-26e2-4ede-9f39-bdb242f0c51d/Img/corded grind/4430840-DBSET.jpg","https://shared1.ad-lister.co.uk/UserImages/fad77979-26e2-4ede-9f39-bdb242f0c51d/Img/2024_02/4430840-MAIN.jpg","https://shared1.ad-lister.co.uk/UserImages/fad77979-26e2-4ede-9f39-bdb242f0c51d/Img/corded grind/49797605.jpg","https://shared1.ad-lister.co.uk/UserImages/bc2f034c-0841-4fff-9e00-38e24b9d45e4/img/EINTEAG230.jpg","https://shared1.ad-lister.co.uk/UserImages/bc2f034c-0841-4fff-9e00-38e24b9d45e4/img/EINTEAG230_A.jpg","https://shared1.ad-lister.co.uk/UserImages/fad77979-26e2-4ede-9f39-bdb242f0c51d/Img/2024_02/4430840-7.jpg","https://shared1.ad-lister.co.uk/UserImages/fad77979-26e2-4ede-9f39-bdb242f0c51d/Img/2024_02/4430840-6.jpg","https://shared1.ad-lister.co.uk/UserImages/bc2f034c-0841-4fff-9e00-38e24b9d45e4/img/EINTEAG230_B.jpg","https://shared1.ad-lister.co.uk/UserImages/fad77979-26e2-4ede-9f39-bdb242f0c51d/Img/2024_02/4430840-5.jpg","https://shared1.ad-lister.co.uk/UserImages/bc2f034c-0841-4fff-9e00-38e24b9d45e4/img/EINTEAG230_C.jpg","https://shared1.ad-lister.co.uk/UserImages/fad77979-26e2-4ede-9f39-bdb242f0c51d/Img/2024_02/4430840-13.jpg","https://shared1.ad-lister.co.uk/UserImages/fad77979-26e2-4ede-9f39-bdb242f0c51d/Img/2024_02/4430840-12.jpg","https://shared1.ad-lister.co.uk/UserImages/fad77979-26e2-4ede-9f39-bdb242f0c51d/Img/2024_02/4430840-11.jpg","https://shared1.ad-lister.co.uk/UserImages/fad77979-26e2-4ede-9f39-bdb242f0c51d/Img/2024_02/4430840-3.jpg","https://shared1.ad-lister.co.uk/UserImages/fad77979-26e2-4ede-9f39-bdb242f0c51d/Img/2024_02/4430840-10.jpg","https://shared1.ad-lister.co.uk/UserImages/fad77979-26e2-4ede-9f39-bdb242f0c51d/Img/2024_02/4430840-9.jpg","","","","","","","","19"
"bd359539-9358-4fa8-b19e-cc96af33d318","EINTHVC1820S","Einhell 2342167 TC-VC 1820S Wet & Dry Vacuum 20 litre 1250W 240V EINTHVC1820S","","71.53","","","","","","","65.31","","","","","","","","","","63.87","65.31","","","64.35","108.84","39.90","<div class='d1'><p>The Einhell TC-VC 1820S Wet &amp; Dry Vacuum is a versatile, powerful, all-round vacuum for simple wet and dry cleaning. It features an easy-to-clean stainless steel tank which has a capacity of 20 litres for devouring coarse or fine, wet or dry dirt and even liquids. It has a powerful motor to provide a poweful suction power and enough pressure to a blow connector for the user-friendly blow-cleaning of inaccessible areas.</p> <p>It is fitted with a foam filter protecting the motor against soiling during wet vacuuming. Also has a float switch which interrupts the suction power automatically when the maximum level is reached, holders for the cable and accessories which enable all parts to be stored away quickly and neatly. With a carry-handle and four smooth-running castors for easy transportation.</p> <p>Supplied with: 1 x 36mm Suction Hose, 1 x Three-Piece Plastic Suction Pipe, 1 x Large Suction Nozzle with Combination Insert for Carpets &amp; Smooth Flooring and 1 x Crevice Nozzle.</p> <p>Specifications:</p> <p>Input Power: 1,250 Watt. <br />Capacity: Wet/Dry: 20 Litre.<br />Suction Hose Length: 1,500mm.<br />Suction Hose Diameter: 36mm.<br />Max Suction Power: 18 kPa.<br />Weight: 4.22kg.</p></d><div class='d2'></d><div class='d3'>Einhell</d><div class='d4'>A02</d><div class='d5'>B2036</d>","<p>Brand: Einhell</p><p>Category: Wet & Dry Vacuums</p><p>Height (mm): 462</p><p>Width (mm): 326</p><p>Depth (mm): 318</p><p>Weight: 6.338</p>","<img src=""https://shared1.ad-lister.co.uk/UserImages/fad77979-26e2-4ede-9f39-bdb242f0c51d/Img/_brandlogos/Einhell_brandlogo.jpg""><br>","","Power Tools > Vacuums & Dust Extraction > Wet & Dry Vacuums","","https://shared1.ad-lister.co.uk/UserImages/bc2f034c-0841-4fff-9e00-38e24b9d45e4/img/EINTHVC1820S.jpg","https://shared1.ad-lister.co.uk/UserImages/bc2f034c-0841-4fff-9e00-38e24b9d45e4/img/EINTHVC1820S_1.jpg","https://shared1.ad-lister.co.uk/UserImages/bc2f034c-0841-4fff-9e00-38e24b9d45e4/img/EINTHVC1820S_2.jpg","https://shared1.ad-lister.co.uk/UserImages/bc2f034c-0841-4fff-9e00-38e24b9d45e4/img/EINTHVC1820S_3.jpg","https://shared1.ad-lister.co.uk/UserImages/bc2f034c-0841-4fff-9e00-38e24b9d45e4/img/EINTHVC1820S_HERO.jpg","","","","","","","","","","","","","","","","","","","","1"
"fdbf1710-05a7-4069-ae01-d0a021bf38cc","EINTPBS18457","Einhell 4466270 TP-BS 18/457 Li BL - Solo Brushless Belt Sander 18V Bare Unit EINTPBS18457","","135.41","","","","","","","122.83","","","","","","","","","","119.93","122.83","","","120.90","162.79","80.60","<div class='d1'><p>The Einhell TP-BS 18/457 Li BL - Solo Belt Sander is a practical tool for evenly sanding large areas. Its brushless motor and electronic speed control are ideal for material and usage-oriented work, providing more control and power. There is also a continuous running lock for comfortable working.</p> <p>The handle and additional handle with soft grip provide optimal handling. With tool-free belt adjustment and lock leaver for quick belt change. It also features an integrated storage surface for stationary use.</p> <p>Part of the Power X-Change series, powered by Lithium-ion rechargeable batteries with a battery management system for a long-life. This belt sander comes as a Bare Unit, NO battery or charger.&nbsp;</p> <p>Supplied with: 3 x P80&nbsp;Sanding Belts, 1 x Dust Box and 1 x Dust Extraction Adaptor.</p> <p>Specifications:</p> <p>Belt Speed: 120-250/min.<br />Belt Size: 75 x 457mm.<br />Sanding Surface: 75 x 126mm.<br />Weight: 2.58kg.</p></d><div class='d2'></d><div class='d3'>Einhell</d><div class='d4'>A02</d><div class='d5'>B2081</d>","<p>Brand: Einhell</p><p>Category: Sanders - Cordless</p><p>Height (mm): 200</p><p>Width (mm): 355</p><p>Depth (mm): 170</p><p>Weight: 3.33</p>","<img src=""https://shared1.ad-lister.co.uk/UserImages/fad77979-26e2-4ede-9f39-bdb242f0c51d/Img/_brandlogos/Einhell_brandlogo.jpg""><br>","","Power Tools > Cordless Sanders & Polishers > Sanders - Cordless","","https://shared1.ad-lister.co.uk/UserImages/bc2f034c-0841-4fff-9e00-38e24b9d45e4/img/EINTPBS18457.jpg","https://shared1.ad-lister.co.uk/UserImages/bc2f034c-0841-4fff-9e00-38e24b9d45e4/img/EINTPBS18457_A.JPG","https://shared1.ad-lister.co.uk/UserImages/bc2f034c-0841-4fff-9e00-38e24b9d45e4/img/EINTPBS18457_INUSE1.JPG","","","","","","","","","","","","","","","","","","","","","","1"
"f358efe4-0377-43fd-9197-d10ae4acb4cc","4257980-17PCSDS","Einhell TC-RH 800 4F 240v SDS Plus 4 Mode Rotary Hammer Drill 800w +17PC SDS Set","Includes Stackable E-BOX with Inlay","106.99","","","","","","","104.99","","","","","","","","","","104.99","104.99","","","99.99","","","<div><strong>Desciption For 4257980&nbsp;</strong><br><br>The Einhell TC-RH 800 4F rotary hammer is a powerful 800 W helper with four basic functions for restoration and renovation jobs: drilling, impact drilling and chiseling with and without lock. Rotary hammers are used whenever the going gets tough. They hammer and drill into tough material such as stone and concrete. The impact pulses literally ""break down” the material, while the cutter eats into the material with its rotating movement and breaks it out. Rotary hammers are suitable for both demolition work and for pulling down or breaking off hard materials such as concrete, brick or stone. The rotary hammer delivers up to 2.6 joule to the tool and with its pneumatic impact mechanism it provides very good forward traction for a drilling capacity of up to 26 mm in concrete. There is a practical position switch for all functions, while the large soft grip surfaces ensure a firm hold and therefore safe handling. The rotary hammer is equipped with a continuous operation lock for comfortable and user-friendly operation and an SDS-plus tool chuck with semi-automatic function. For all its power, the electronic speed control ensures that the tool can be adjusted to each particular material and application, and for safety there is an overload slip coupling. The infinitely adjustable drilling depth stop is made of stable plastic. The product is supplied in a practical E-Box Basic transport and storage case.<br>&nbsp;<br>Features<br>&nbsp;<br>4 functions: drilling/hammer drilling/chiselling with &amp; without fixing<br>Overload slipping clutch for increased user safety<br>One position switch for all functions<br>Large softgrip surfaces for comfortable working<br>Continuous running lock for pleasant and easy working.<br>Pneumatic impact mechanism for excellent propulsion<br>Robust SDS-plus tool holder with semi-automatic operation<br>Speed electronics for material- and application-appropriate work<br>Infinitely adjustable plastic drill depth stop<br>Comes in an E-Box Basic transport and storage case</div><div></div><div>&nbsp;</div><div><strong>Included in this set:</strong></div><div>DHR242Z Brushless SDS Drill<br>17 Piece SDS Set + Chisel</div>","<div><strong>Specifications For 4257980&nbsp;</strong><br><br>Impact strength - 2.6J<br>Max. drilling power concrete - 26mm<br>Number of transmission gears - 1<br>Power - 800 W<br>Power cable length - 3m<br>Product weight - 3.12Kg<br>Transmission material - Stainless steel<br>EAN: 4006825634570</div><div>&nbsp;</div><div><strong>Specifications For SP-17229</strong><br><br>Sizes:<br>5 x 110mm<br>5.5 x 110mm<br>6 x 110mm<br>6 x 160mm<br>7 x 160mm<br>8 x 110mm<br>8 x 160mm<br>8 x 210mm<br>10 x 110mm<br>10 x 160mm<br>10 x 210mm<br>14 x 260mm<br><br>5 Chisels for SDS-plus hammers<br>Bull Point 140mm, 250mm<br>Cold Chisel 140 x 20mm, 250 x 20mm<br>Flat Chisel 250 x 40mm<br><br>Includes:<br>Tool Roll<br>12xHammer Drill Bits:<br>5x110mm,5.5x110mm,6x110mm,8x110mm,10x110mm<br>6x160mm,7x160mm,8x160mm,10x160mm,8x210mm,10x210mm<br>14x260mm<br><br>2xPoint Chisel<br>14x140mm,14x250mm<br><br>3xFlat Chisel<br>14x140x20mm,14x250x20mm,14x250x40mm<br><div><br></div></div>","<img src=""https://shared1.ad-lister.co.uk/UserImages/fad77979-26e2-4ede-9f39-bdb242f0c51d/Img/_brandlogos/Einhell_brandlogo.jpg""><br><br><br>","<img src=""https://shared1.ad-lister.co.uk/UserImages/fad77979-26e2-4ede-9f39-bdb242f0c51d/Img/_authdealerlogo/einhell_auth.jpg""><br><br>","","Desciption For 4257980   The Einhell TC-RH 800 4F rotary hammer is a powerful 800 W helper with four basic functions for restoration and renovation jobs: drilling, impact drilling and chiseling with and without lock. Rotary hammers are used whenever the going gets tough. They hammer and drill into tough material such as stone and concrete. The impact pulses literally ""break down” the material, while the cutter eats into the material with its rotating movement and breaks it out. Rotary hammers are suitable for both demolition work and for pulling down or breaking off hard materials such as concrete, brick or stone. The rotary hammer delivers up to 2.6 joule to the tool and with its pneumatic impact mechanism it provides very good forward traction for a drilling capacity of up to 26 mm in concrete. There is a practical position switch for all functions, while the large soft grip surfaces ensure a firm hold and therefore safe handling. The rotary hammer is equipped with a continuous operation lock for comfortable and user-friendly operation and an SDS-plus tool chuck with semi-automatic function. For all its power, the electronic speed control ensures that the tool can be adjusted to each particular material and application, and for safety there is an overload slip coupling. The infinitely adjustable drilling depth stop is made of stable plastic. The product is supplied in a practical E-Box Basic transport and storage case.   Features   4 functions: drilling/hammer drilling/chiselling with & without fixing Overload slipping clutch for increased user safety One position switch for all functions Large softgrip surfaces for comfortable working Continuous running lock for pleasant and easy working. Pneumatic impact mechanism for excellent propulsion Robust SDS-plus tool holder with semi-automatic operation Speed electronics for material- and application-appropriate work Infinitely adjustable plastic drill depth stop Comes in an E-Box Basic transport and storage case ​ Included in this set: DHR242Z Brushless SDS Drill 17 Piece SDS Set + Chisel","https://shared1.ad-lister.co.uk/UserImages/fad77979-26e2-4ede-9f39-bdb242f0c51d/Img/corded percu/4257980-17PCSDS.jpg","https://shared1.ad-lister.co.uk/UserImages/fad77979-26e2-4ede-9f39-bdb242f0c51d/Img/2024_02/4257980-MAIN.jpg","https://shared1.ad-lister.co.uk/UserImages/fad77979-26e2-4ede-9f39-bdb242f0c51d/Img/corded percu/SP-17229.jpg","https://shared1.ad-lister.co.uk/UserImages/fad77979-26e2-4ede-9f39-bdb242f0c51d/Img/corded percu/4257980.jpg","https://shared1.ad-lister.co.uk/UserImages/fad77979-26e2-4ede-9f39-bdb242f0c51d/Img/corded percu/4257980-2.jpg","https://shared1.ad-lister.co.uk/UserImages/fad77979-26e2-4ede-9f39-bdb242f0c51d/Img/corded percu/4257980-1.jpg","https://shared1.ad-lister.co.uk/UserImages/fad77979-26e2-4ede-9f39-bdb242f0c51d/Img/corded percu/4257980-3.jpg","https://shared1.ad-lister.co.uk/UserImages/fad77979-26e2-4ede-9f39-bdb242f0c51d/Img/corded percu/4257980-4.jpg","https://shared1.ad-lister.co.uk/UserImages/fad77979-26e2-4ede-9f39-bdb242f0c51d/Img/corded percu/4257980-5.jpg","https://shared1.ad-lister.co.uk/UserImages/fad77979-26e2-4ede-9f39-bdb242f0c51d/Img/2024_02/4257980-12.jpg","https://shared1.ad-lister.co.uk/UserImages/fad77979-26e2-4ede-9f39-bdb242f0c51d/Img/2024_02/4257980-13.jpg","https://shared1.ad-lister.co.uk/UserImages/fad77979-26e2-4ede-9f39-bdb242f0c51d/Img/2024_02/4257980-14.jpg","https://shared1.ad-lister.co.uk/UserImages/fad77979-26e2-4ede-9f39-bdb242f0c51d/Img/2024_02/4257980-15.jpg","https://shared1.ad-lister.co.uk/UserImages/fad77979-26e2-4ede-9f39-bdb242f0c51d/Img/2024_02/4257980-16.jpg","https://shared1.ad-lister.co.uk/UserImages/fad77979-26e2-4ede-9f39-bdb242f0c51d/Img/2024_02/4257980-20.jpg","https://shared1.ad-lister.co.uk/UserImages/fad77979-26e2-4ede-9f39-bdb242f0c51d/Img/2024_02/4257980-17.jpg","https://shared1.ad-lister.co.uk/UserImages/fad77979-26e2-4ede-9f39-bdb242f0c51d/Img/corded percu/SP-17229-1.jpg","","","","","","","","1"
