"3b3e7158-1a08-49b2-80ec-387945ce32ce","100-100-583","Hozelock 30m Select Garden Hose Pipe Starter Set & Fittings Attachments 7230","","43.28","","","","","","","39.99","","","","","","","","","","39.99","39.99","","","38.99","79.99","","<div class=""d1""><p>Ideal for new gardeners, or for those who want a simple, yet hard wearing multi-purpose hose for general garden watering tasks.<br><br>Select Hose render showing 4 layers within the hose</p><p>1. Weather proof with UV &amp; frost protection guarantees that your hose can be used effectively in a range of climates from -20°C up to 40°C.<br><br>2. Braided technology maintains the structure ensuring water is effectively delivered to your garden.<br><br>3. Flexible PVC for added strength and easy handling.<br><br>4. Smooth Inner Layer to enhance water flow.</p><div>Hose is made from 70% recycled materials and is guaranteed free of heavy metals.</div><p><strong>Includes</strong></p> <p>1 x 3/4in and 1/2in Tap Connector to attach to an outside tap.<br>1 x Hose End Connector to attach the hose to the tap.<br>1 x AquaStop Connector to connect the end of the hose to the nozzle.<br>1 x Spray Nozzle.</p><div class=""d2""><p><br><br><br></p></div></div>","<p>Brand: Hozelock</p><p>Category: Hoses</p><p>Height (mm): 340</p><p>Width (mm): 110</p><p>Depth (mm): 340</p><p>Weight: 3.122</p><div>Diameter: 12.5mm (1/2in).</div><div>&nbsp;</div><div>Guarantee: 10-Years.</div>","<img src=""https://shared1.ad-lister.co.uk/UserImages/fad77979-26e2-4ede-9f39-bdb242f0c51d/Img/_brandlogos/Hozelock_brandlogo.jpg""><br>","","","Ideal for new gardeners, or for those who want a simple, yet hard wearing multi-purpose hose for general garden watering tasks. Select Hose render showing 4 layers within the hose 1. Weather proof with UV frost protection guarantees that your hose can be used effectively in a range of climates from -20°C up to 40°C. 2. Braided technology maintains the structure ensuring water is effectively delivered to your garden. 3. Flexible PVC for added strength and easy handling. 4. Smooth Inner Layer to enhance water flow. Hose is made from 70% recycled materials and is guaranteed free of heavy metals. Includes  1 x 3/4in and 1/2in Tap Connector to attach to an outside tap. 1 x Hose End Connector to attach the hose to the tap. 1 x AquaStop Connector to connect the end of the hose ...","https://shared1.ad-lister.co.uk/UserImages/bc2f034c-0841-4fff-9e00-38e24b9d45e4/img/HOZ100100583.jpg","https://shared1.ad-lister.co.uk/UserImages/bc2f034c-0841-4fff-9e00-38e24b9d45e4/img/HOZ100100583_INUSE.JPG","","","","","","","","","","","","","","","","","","","","","","","6"
"acb9d026-d812-4126-8fba-3f8591e3cdc2","EINTEAG18LK","Einhell 4431119 TE-AG 18 Li Power X-Change Angle Grinder 115mm 18V 1 x 3.0Ah Li-ion EINTEAG18LK","","166.27","","","","","","","148.69","","","","","","","","","","146.35","148.69","","","145.17","195.38","97.69","<div class='d1'><p>The Einhell TE-AG 18 Li Kit Power X-Change Angle Grinder is supplied with:</p> <p>1 x 18V 3.0Ah Li-ion Battery.<br />1 x Charger.<br />1 x Carry Case.</p></d><div class='d2'><p>The Einhell TE-AG 18 Li Power X-Change Angle Grinder is a very handy, compact tool and is the lightest angle grinder of its class. It has a robust, aluminium gear housing and a very smooth operation thanks to the separation of motor and gearing.</p> <p>The soft start function and restart safeguard make it safer to use and there is an overload cut-out for a long service life. The modified air guidance provides better cooling and the disc guard has a quick-adjust facility. The slimline design has been fitted with ergonomic, soft grip surfaces and the additional handle can be fitted flexibly in 3 positions.</p> <p>It is a member of the Power X-Change family and is powered by Lithium-ion rechargeable batteries with a battery management system for a long life.</p> <p>Specifications:</p> <p>No Load Speed: 8,500/min.<br />Disc Diameter: 115mm.<br />Max Cutting Depth: 28mm.<br />Weight: 1.21kg.</p></d><div class='d3'>Einhell</d><div class='d4'>A02</d><div class='d5'>B2083</d>","<p>Brand: Einhell</p><p>Category: Angle Grinders - Cordless</p><p>Height (mm): 350</p><p>Width (mm): 110</p><p>Depth (mm): 330</p><p>Weight: 4.4</p>","<img src=""https://shared1.ad-lister.co.uk/UserImages/fad77979-26e2-4ede-9f39-bdb242f0c51d/Img/_brandlogos/Einhell_brandlogo.jpg""><br>","","Power Tools > Cordless Angle Grinders, Wall Chasers & Metalworking Tools > Angle Grinders - Cordless","","https://shared1.ad-lister.co.uk/UserImages/bc2f034c-0841-4fff-9e00-38e24b9d45e4/img/EINTEAG18LK.jpg","","","","","","","","","","","","","","","","","","","","","","","","1"
"a1b4aa14-fcc5-4e9c-949e-401fd66b5df2","4257980X7-17PCSDS","Einhell 240v SDS Plus 4 Mode Rotary Hammer Drill + 17PC Chisel Set Keyless Chuck","Includes Stackable E-BOX with Inlay","111.99","","","","","","","109.99","","","","","","","","","","109.99","109.99","","","104.99","","","<div><strong>Desciption For 4257980&nbsp;</strong><br><br>The Einhell TC-RH 800 4F rotary hammer is a powerful 800 W helper with four basic functions for restoration and renovation jobs: drilling, impact drilling and chiseling with and without lock. Rotary hammers are used whenever the going gets tough. They hammer and drill into tough material such as stone and concrete. The impact pulses literally ""break down” the material, while the cutter eats into the material with its rotating movement and breaks it out. Rotary hammers are suitable for both demolition work and for pulling down or breaking off hard materials such as concrete, brick or stone. The rotary hammer delivers up to 2.6 joule to the tool and with its pneumatic impact mechanism it provides very good forward traction for a drilling capacity of up to 26 mm in concrete. There is a practical position switch for all functions, while the large soft grip surfaces ensure a firm hold and therefore safe handling. The rotary hammer is equipped with a continuous operation lock for comfortable and user-friendly operation and an SDS-plus tool chuck with semi-automatic function. For all its power, the electronic speed control ensures that the tool can be adjusted to each particular material and application, and for safety there is an overload slip coupling. The infinitely adjustable drilling depth stop is made of stable plastic. The product is supplied in a practical E-Box Basic transport and storage case.<br>&nbsp;<br>Features<br>&nbsp;<br>4 functions: drilling/hammer drilling/chiselling with &amp; without fixing<br>Overload slipping clutch for increased user safety<br>One position switch for all functions<br>Large softgrip surfaces for comfortable working<br>Continuous running lock for pleasant and easy working.<br>Pneumatic impact mechanism for excellent propulsion<br>Robust SDS-plus tool holder with semi-automatic operation<br>Speed electronics for material- and application-appropriate work<br>Infinitely adjustable plastic drill depth stop<br><br><strong>Included in this set:</strong><br>4257980 Hammer Drill&nbsp;<br>17 Piece SDS Set + Chisel<br>Keyless Chuck<br>SDS Chuck Adaptor</div>","<div><strong>Specifications For 4257980<br></strong><br>Impact strength - 2.6J<br>Max. drilling power concrete - 26mm<br>Number of transmission gears - 1<br>Power - 800 W<br>Power cable length - 3m<br>Product weight - 3.12Kg<br>Transmission material - Stainless steel<br>EAN: 4006825634570</div><div>&nbsp;</div><div><strong>Included in this set:</strong><br>4257980 Hammer Drill&nbsp;<br>17 Piece SDS Set + Chisel<br>Keyless Chuck<br>SDS Chuck Adaptor</div>","<img src=""https://shared1.ad-lister.co.uk/UserImages/fad77979-26e2-4ede-9f39-bdb242f0c51d/Img/_brandlogos/Einhell_brandlogo.jpg""><br><br><br>","<img src=""https://shared1.ad-lister.co.uk/UserImages/fad77979-26e2-4ede-9f39-bdb242f0c51d/Img/_authdealerlogo/einhell_auth.jpg""><br><br>","","Desciption For 4257980   The Einhell TC-RH 800 4F rotary hammer is a powerful 800 W helper with four basic functions for restoration and renovation jobs: drilling, impact drilling and chiseling with and without lock. Rotary hammers are used whenever the going gets tough. They hammer and drill into tough material such as stone and concrete. The impact pulses literally ""break down” the material, while the cutter eats into the material with its rotating movement and breaks it out. Rotary hammers are suitable for both demolition work and for pulling down or breaking off hard materials such as concrete, brick or stone. The rotary hammer delivers up to 2.6 joule to the tool and with its pneumatic impact mechanism it provides very good forward traction for a drilling capacity of up to 26 mm in concrete. There is a practical position switch for all functions, while the large soft grip surfaces ensure a firm hold and therefore safe handling. The rotary hammer is equipped with a continuous operation lock for comfortable and user-friendly operation and an SDS-plus tool chuck with semi-automatic function. For all its power, the electronic speed control ensures that the tool can be adjusted to each particular material and application, and for safety there is an overload slip coupling. The infinitely adjustable drilling depth stop is made of stable plastic. The product is supplied in a practical E-Box Basic transport and storage case.   Features   4 functions: drilling/hammer drilling/chiselling with & without fixing Overload slipping clutch for increased user safety One position switch for all functions Large softgrip surfaces for comfortable working Continuous running lock for pleasant and easy working. Pneumatic impact mechanism for excellent propulsion Robust SDS-plus tool holder with semi-automatic operation Speed electronics for material- and application-appropriate work Infinitely adjustable plastic drill depth stop  Included in this set: 4257980 Hammer Drill  17 Piece SDS Set + Chisel Keyless Chuck SDS Chuck Adaptor ","https://shared1.ad-lister.co.uk/UserImages/fad77979-26e2-4ede-9f39-bdb242f0c51d/Img/corded percu/4257980x7-17pcsds.jpg","https://shared1.ad-lister.co.uk/UserImages/fad77979-26e2-4ede-9f39-bdb242f0c51d/Img/2024_02/4257980-MAIN.jpg","https://shared1.ad-lister.co.uk/UserImages/fad77979-26e2-4ede-9f39-bdb242f0c51d/Img/corded percu/sds-bits-+-chuck.jpg","https://shared1.ad-lister.co.uk/UserImages/fad77979-26e2-4ede-9f39-bdb242f0c51d/Img/corded percu/sds-chuck.jpg","https://shared1.ad-lister.co.uk/UserImages/fad77979-26e2-4ede-9f39-bdb242f0c51d/Img/corded percu/4257980.jpg","https://shared1.ad-lister.co.uk/UserImages/fad77979-26e2-4ede-9f39-bdb242f0c51d/Img/corded percu/4257980-2.jpg","https://shared1.ad-lister.co.uk/UserImages/fad77979-26e2-4ede-9f39-bdb242f0c51d/Img/corded percu/4257980-1.jpg","https://shared1.ad-lister.co.uk/UserImages/fad77979-26e2-4ede-9f39-bdb242f0c51d/Img/corded percu/4257980-3.jpg","https://shared1.ad-lister.co.uk/UserImages/fad77979-26e2-4ede-9f39-bdb242f0c51d/Img/corded percu/4257980-4.jpg","https://shared1.ad-lister.co.uk/UserImages/fad77979-26e2-4ede-9f39-bdb242f0c51d/Img/corded percu/4257980-5.jpg","https://shared1.ad-lister.co.uk/UserImages/fad77979-26e2-4ede-9f39-bdb242f0c51d/Img/2024_02/4257980-12.jpg","https://shared1.ad-lister.co.uk/UserImages/fad77979-26e2-4ede-9f39-bdb242f0c51d/Img/2024_02/4257980-13.jpg","https://shared1.ad-lister.co.uk/UserImages/fad77979-26e2-4ede-9f39-bdb242f0c51d/Img/2024_02/4257980-14.jpg","https://shared1.ad-lister.co.uk/UserImages/fad77979-26e2-4ede-9f39-bdb242f0c51d/Img/2024_02/4257980-15.jpg","https://shared1.ad-lister.co.uk/UserImages/fad77979-26e2-4ede-9f39-bdb242f0c51d/Img/2024_02/4257980-16.jpg","https://shared1.ad-lister.co.uk/UserImages/fad77979-26e2-4ede-9f39-bdb242f0c51d/Img/2024_02/4257980-20.jpg","https://shared1.ad-lister.co.uk/UserImages/fad77979-26e2-4ede-9f39-bdb242f0c51d/Img/2024_02/4257980-17.jpg","","","","","","","","1"
"26e2c469-10cf-43ae-8589-41e9d337aab7","EINTCMG220","Einhell 4465095 TC-MG 220/1 E Multi-Tool 220W 240V EINTCMG220","","55.27","","","","","","","50.56","","","","","","","","","","49.47","50.56","","","49.83","60.44","30.22","<div class='d1'><p>The Einhell TC-MG 220/1 E Multi-Tool is a compact and highly versatile machine that can perform a variety of tasks: sawing, sanding, scraping and much more are quick and easy to perform with this handy all-rounder. The electronic speed control ensures that the power is exactly tailored to your operation. It has a robust aluminium driveshaft that has been designed for intensive use. The soft painted housing mount and mounted soft grip make it comfortable and easy to grip.</p> <p>Supplied with:</p> <p>1 x Delta Sanding Disc With Dust Extraction.<br />1 x Sanding Paper.<br />1 x Scraper.<br />1 x RAID-Blade For Wood.<br />1 x Dust Extraction Adapter.<br />2 x Allen Keys.</p> <p>Specifications:</p> <p>Input Power: 220W.<br />No Load Speed: 15,000-22,000/min.<br />Oscillation Angle: 3&deg;.<br />Grinding Area: 90 x 90 x 90mm.<br />Weight: 1.8kg.</p></d><div class='d2'></d><div class='d3'>Einhell</d><div class='d4'>A02</d><div class='d5'>B2064</d>","<p>Brand: Einhell</p><p>Category: Multi-Function Tool</p><p>Height (mm): 333</p><p>Width (mm): 94</p><p>Depth (mm): 120</p><p>Weight: 1.832</p>","<img src=""https://shared1.ad-lister.co.uk/UserImages/fad77979-26e2-4ede-9f39-bdb242f0c51d/Img/_brandlogos/Einhell_brandlogo.jpg""><br>","","Power Tools > Multi-Function Tools & Engravers > Multi-Function Tool","","https://shared1.ad-lister.co.uk/UserImages/bc2f034c-0841-4fff-9e00-38e24b9d45e4/img/EINTCMG220.jpg","https://shared1.ad-lister.co.uk/UserImages/bc2f034c-0841-4fff-9e00-38e24b9d45e4/img/EINTCMG220_A.JPG","","","","","","","","","","","","","","","","","","","","","","","1"
"f12f9d20-af08-41cd-8d3b-43610d5d1c41","BSTOCK-A16","Roughneck 64-385 64-385 Shock Absorbing Tamper 4.5kg (10 lb) ROU64385","","57.38","","","","","","","52.52","","","","","","","","","","52.52","39.99","","46.68","51.77","87.60","34.68","<div class=""d1""><p>The Roughneck Shock Absorbing Tamper has a reinforced cast iron head. There is a rubber pad built-in between the handle and the head to absorb shock and help eliminate user fatigue.</p><div class=""d2""><div class=""d3"">Roughneck<div class=""d4"">A01<div class=""d5"">B0001</div></div></div></div></div>","<p>Brand: Roughneck</p><p>Category: Groundwork Tools</p><p>Height (mm): 65</p><p>Width (mm): 955</p><p>Depth (mm): 210</p><p>Weight: 6.32</p>","<img src=""https://shared1.ad-lister.co.uk/UserImages/fad77979-26e2-4ede-9f39-bdb242f0c51d/Img/_brandlogos/Roughneck_brandlogo.jpg""><br>","<img src=""https://shared1.ad-lister.co.uk/UserImages/fad77979-26e2-4ede-9f39-bdb242f0c51d/Img/_authdealerlogo/roughneck_auth.jpg""><br>","","The Roughneck Shock Absorbing Tamper has a reinforced cast iron head with a perfectly flat face and an all-steel handle. There is a rubber pad built-in between the handle and the head to absorb shock and help eliminate user fatigue.  Roughneck A01 B0001","https://shared1.ad-lister.co.uk/UserImages/bc2f034c-0841-4fff-9e00-38e24b9d45e4/img/ROU64385_A.jpg","","","","","","","","","","","","","","","","","","","","","","","","1"
"984b23f6-9752-4d16-96df-46e3de66d27b","4340515","Einhell TC-TS 2225 U Corded Table Saw 254mm 2200W 240v + Stand + Blade","","199.99","","","","","","","188.99","","","","","","","","","","188.99","188.99","","","186.99","239.99","","<div>The Einhell TC-TS 2225 U bench-type circular saw is a high-performance tool for performing precise and flexible work. The sturdy parallel stop with clamps on both sides enables longitudinal cuts to be performed, and for effortless angle cuts the angle stop or the tilting saw blade can be used. If a larger support surface is needed, there are pull-out side tables and a length extension at the back. The powerful motor is designed to handle major jobs as well, and it has an integrated soft start function for protecting both it and the fuses. Holders on the housing are practical features for holding the supplied stops and tools, the push stick and the power cable.</div><div>&nbsp;</div><div><strong>Features</strong></div><p> </p><p> Sturdy parallel stop with double clamp for precise cuts<br>Featuring a soft start function: Protects the motor and fuses<br>Extremely powerful motor with plenty of reserves for tough jobs<br>Pull-out side tables and length extension for large workpieces<br>A cross stop which also serves as an angle stop (+/- 45°)<br>Supplied stops and tools have holders on the housing<br>Connection for dust extractor at the housing and saw blade cover<br>The sturdy underframe enables a pleasant working height (870 mm)<br>Plastic housing with integrated stabilising metal struts</p><div><strong>Includes</strong><br></div><div>&nbsp;</div><div>TC-TS 2225 U Table Saw 240v<br>Stand<br>48 Tooth Blade</div><div><br></div>","Mains supply: 220-240 V / 50 Hz<br>Power: 1800 W<br>Max. power (S6 / S6%): 2200 W / 25 %<br>Idle speed: 4250 min^-1<br>Saw blade: Ø254 x ø30<br>Number of saw teeth: 48 Pieces<br>Swiveling range of saw blade: 45 °<br>Max. cutting height at 45°: 55 mm<br>Max. cutting height at 90°: 80 mm<br>Height adjustment continuous: 0-80 mm<br>Diameter of suction adapter: 36 mm<br>Working height: 870 mm<br>Size of working table: 580 x 555<br>Table broadening left: 580 x 150<br>Table broadening right: 580 x 150<br>Table length extension back side: 555","<img src=""https://shared1.ad-lister.co.uk/UserImages/fad77979-26e2-4ede-9f39-bdb242f0c51d/Img/_brandlogos/einhell_brandlogo.jpg""><br><br><br>","<img src=""https://shared1.ad-lister.co.uk/UserImages/fad77979-26e2-4ede-9f39-bdb242f0c51d/Img/_authdealerlogo/einhell_auth.jpg""><br>","","Sturdy parallel stop with double clamp for precise cuts Featuring a soft start function: Protects the motor and fuses Extremely powerful motor with plenty of reserves for tough jobs Pull-out side tables and length extension for large workpieces A cross stop which also serves as an angle stop (+/- 45°) Supplied stops and tools have holders on the housing Connection for dust extractor at the housing and saw blade cover The sturdy underframe enables a pleasant working height (870 mm) Plastic housing with integrated stabilising metal struts ","https://shared1.ad-lister.co.uk/UserImages/fad77979-26e2-4ede-9f39-bdb242f0c51d/Img/corded table/4340515.jpg","https://shared1.ad-lister.co.uk/UserImages/fad77979-26e2-4ede-9f39-bdb242f0c51d/Img/corded table/4340515-1.jpg","https://shared1.ad-lister.co.uk/UserImages/fad77979-26e2-4ede-9f39-bdb242f0c51d/Img/corded table/4340515-2.jpg","https://shared1.ad-lister.co.uk/UserImages/fad77979-26e2-4ede-9f39-bdb242f0c51d/Img/2024_02/4340515-10.jpg","https://shared1.ad-lister.co.uk/UserImages/fad77979-26e2-4ede-9f39-bdb242f0c51d/Img/2024_02/4340515-9.jpg","https://shared1.ad-lister.co.uk/UserImages/fad77979-26e2-4ede-9f39-bdb242f0c51d/Img/2024_02/4340515-8.jpg","https://shared1.ad-lister.co.uk/UserImages/fad77979-26e2-4ede-9f39-bdb242f0c51d/Img/2024_02/4340515-7.jpg","https://shared1.ad-lister.co.uk/UserImages/fad77979-26e2-4ede-9f39-bdb242f0c51d/Img/2024_02/4340515-6.jpg","https://shared1.ad-lister.co.uk/UserImages/fad77979-26e2-4ede-9f39-bdb242f0c51d/Img/2024_02/4340515-15.jpg","https://shared1.ad-lister.co.uk/UserImages/fad77979-26e2-4ede-9f39-bdb242f0c51d/Img/2024_02/4340515-14.jpg","https://shared1.ad-lister.co.uk/UserImages/fad77979-26e2-4ede-9f39-bdb242f0c51d/Img/2024_02/4340515-13.jpg","https://shared1.ad-lister.co.uk/UserImages/fad77979-26e2-4ede-9f39-bdb242f0c51d/Img/2024_02/4340515-12.jpg","https://shared1.ad-lister.co.uk/UserImages/fad77979-26e2-4ede-9f39-bdb242f0c51d/Img/2024_02/4340515-11.jpg","","","","","","","","","","","","1"
