"Id","SKU","Title","Subtitle","Amazon price","Magento Price","Magento SpecialPrice","Magento SpecialPriceFrom","Magento SpecialPriceTo","Shopify Price","Facebook Price","BnQ Price","BnQ Discount Price","BnQ Discount Start Date","BnQ Discount End Date","BigCommerce Price","Etsy Price","Walmart Price","OnBuy Price","Newegg price","Sears Price","Starting price","BIN price","Reserve price","Trade price","Web price","RRP price","Cost price","Description","Inventory field 1","Inventory field 2","Inventory field 3","Inventory field 4","Description summary","Image1","Image2","Image3","Image4","Image5","Image6","Image7","Image8","Image9","Image10","Image11","Image12","Image13","Image14","Image15","Image16","Image17","Image18","Image19","Image20","Image21","Image22","Image23","Image24","QTY"
"517ea7b9-c972-40a6-9072-02b8e27a25c8","4257980X7-KIT","Einhell 240v SDS Plus 4 Mode Rotary Hammer Drill + Keyless Chuck + Adapter ","Includes Stackable E-BOX with Inlay","94.99","","","","","","","89.99","","","","","","","","","","89.99","89.99","","","84.99","","","<strong>Desciption For 4257980&nbsp;</strong><br><br>The Einhell TC-RH 800 4F rotary hammer is a powerful 800 W helper with four basic functions for restoration and renovation jobs: drilling, impact drilling and chiseling with and without lock. Rotary hammers are used whenever the going gets tough. They hammer and drill into tough material such as stone and concrete. The impact pulses literally ""break down” the material, while the cutter eats into the material with its rotating movement and breaks it out. Rotary hammers are suitable for both demolition work and for pulling down or breaking off hard materials such as concrete, brick or stone. The rotary hammer delivers up to 2.6 joule to the tool and with its pneumatic impact mechanism it provides very good forward traction for a drilling capacity of up to 26 mm in concrete. There is a practical position switch for all functions, while the large soft grip surfaces ensure a firm hold and therefore safe handling. The rotary hammer is equipped with a continuous operation lock for comfortable and user-friendly operation and an SDS-plus tool chuck with semi-automatic function. For all its power, the electronic speed control ensures that the tool can be adjusted to each particular material and application, and for safety there is an overload slip coupling. The infinitely adjustable drilling depth stop is made of stable plastic. The product is supplied in a practical E-Box Basic transport and storage case.<br>&nbsp;<br>Features<br>&nbsp;<br>4 functions: drilling/hammer drilling/chiselling with &amp; without fixing<br>Overload slipping clutch for increased user safety<br>One position switch for all functions<br>Large softgrip surfaces for comfortable working<br>Continuous running lock for pleasant and easy working.<br>Pneumatic impact mechanism for excellent propulsion<br>Robust SDS-plus tool holder with semi-automatic operation<br>Speed electronics for material- and application-appropriate work<br>Infinitely adjustable plastic drill depth stop<br><br><strong>Included In This Kit:</strong><br>4257980 Hammer Drill<br>Keyless Chuck<br>SDS Chuck Adaptor","<div><strong>Specifications For 4257980</strong><br><br>Impact strength - 2.6J<br>Max. drilling power concrete - 26mm<br>Number of transmission gears - 1<br>Power - 800 W<br>Power cable length - 3m<br>Product weight - 3.12Kg<br>Transmission material - Stainless steel<br>EAN: 4006825634570</div><div>&nbsp;</div><div><strong>Included In This Kit:</strong><br>4257980 Hammer Drill<br>Keyless Chuck<br>SDS Chuck Adaptor</div>","<img src=""https://shared1.ad-lister.co.uk/UserImages/fad77979-26e2-4ede-9f39-bdb242f0c51d/Img/_brandlogos/Einhell_brandlogo.jpg""><br><br><br>","<img src=""https://shared1.ad-lister.co.uk/UserImages/fad77979-26e2-4ede-9f39-bdb242f0c51d/Img/_authdealerlogo/einhell_auth.jpg""><br><br>",""," Desciption For 4257980   The Einhell TC-RH 800 4F rotary hammer is a powerful 800 W helper with four basic functions for restoration and renovation jobs: drilling, impact drilling and chiseling with and without lock. Rotary hammers are used whenever the going gets tough. They hammer and drill into tough material such as stone and concrete. The impact pulses literally ""break down” the material, while the cutter eats into the material with its rotating movement and breaks it out. Rotary hammers are suitable for both demolition work and for pulling down or breaking off hard materials such as concrete, brick or stone. The rotary hammer delivers up to 2.6 joule to the tool and with its pneumatic impact mechanism it provides very good forward traction for a drilling capacity of up to 26 mm in concrete. There is a practical position switch for all functions, while the large soft grip surfaces ensure a firm hold and therefore safe handling. The rotary hammer is equipped with a continuous operation lock for comfortable and user-friendly operation and an SDS-plus tool chuck with semi-automatic function. For all its power, the electronic speed control ensures that the tool can be adjusted to each particular material and application, and for safety there is an overload slip coupling. The infinitely adjustable drilling depth stop is made of stable plastic. The product is supplied in a practical E-Box Basic transport and storage case.   Features   4 functions: drilling/hammer drilling/chiselling with & without fixing Overload slipping clutch for increased user safety One position switch for all functions Large softgrip surfaces for comfortable working Continuous running lock for pleasant and easy working. Pneumatic impact mechanism for excellent propulsion Robust SDS-plus tool holder with semi-automatic operation Speed electronics for material- and application-appropriate work Infinitely adjustable plastic drill depth stop  Inducled In This Kit: 4257980 Hammer Drill Keyless Chuck SDS Chuck Adaptor","https://shared1.ad-lister.co.uk/UserImages/fad77979-26e2-4ede-9f39-bdb242f0c51d/Img/corded percu/4257980X7-KIT.jpg","https://shared1.ad-lister.co.uk/UserImages/fad77979-26e2-4ede-9f39-bdb242f0c51d/Img/2024_02/4257980-MAIN.jpg","https://shared1.ad-lister.co.uk/UserImages/fad77979-26e2-4ede-9f39-bdb242f0c51d/Img/corded percu/sds-chuck.jpg","https://shared1.ad-lister.co.uk/UserImages/fad77979-26e2-4ede-9f39-bdb242f0c51d/Img/corded percu/4257980.jpg","https://shared1.ad-lister.co.uk/UserImages/fad77979-26e2-4ede-9f39-bdb242f0c51d/Img/corded percu/4257980-2.jpg","https://shared1.ad-lister.co.uk/UserImages/fad77979-26e2-4ede-9f39-bdb242f0c51d/Img/corded percu/4257980-1.jpg","https://shared1.ad-lister.co.uk/UserImages/fad77979-26e2-4ede-9f39-bdb242f0c51d/Img/corded percu/4257980-3.jpg","https://shared1.ad-lister.co.uk/UserImages/fad77979-26e2-4ede-9f39-bdb242f0c51d/Img/corded percu/4257980-4.jpg","https://shared1.ad-lister.co.uk/UserImages/fad77979-26e2-4ede-9f39-bdb242f0c51d/Img/corded percu/4257980-5.jpg","https://shared1.ad-lister.co.uk/UserImages/fad77979-26e2-4ede-9f39-bdb242f0c51d/Img/2024_02/4257980-12.jpg","https://shared1.ad-lister.co.uk/UserImages/fad77979-26e2-4ede-9f39-bdb242f0c51d/Img/2024_02/4257980-13.jpg","https://shared1.ad-lister.co.uk/UserImages/fad77979-26e2-4ede-9f39-bdb242f0c51d/Img/2024_02/4257980-14.jpg","https://shared1.ad-lister.co.uk/UserImages/fad77979-26e2-4ede-9f39-bdb242f0c51d/Img/2024_02/4257980-15.jpg","https://shared1.ad-lister.co.uk/UserImages/fad77979-26e2-4ede-9f39-bdb242f0c51d/Img/2024_02/4257980-16.jpg","https://shared1.ad-lister.co.uk/UserImages/fad77979-26e2-4ede-9f39-bdb242f0c51d/Img/2024_02/4257980-20.jpg","https://shared1.ad-lister.co.uk/UserImages/fad77979-26e2-4ede-9f39-bdb242f0c51d/Img/2024_02/4257980-17.jpg","","","","","","","","","1"
"b8d6bf95-43ef-458b-9a30-046302a0caef","23-36_10","Pack of 10 Bahco 23-36 Bow Saw Raker Tooth Hard Point Bowsaw Blade 91cm 36in","","39.95","","","","","","","39.95","0.00","","","","","","","","","38.95","38.95","","","36.95","168.60","6.67","<div class=""d1""><p>10 x Bahco 23-36 Raker Tooth Hard Point Bowsaw Blades 900mm (36in)</p><div class=""d2""><p>Bahco Raker Tooth Hard Point Bowsaw Blade are ideal for cutting in green wood. Made from hardened and tempered high quality steel with high frequency, induction hardened peg toothing.</p> <p>They have been treated with a rust prevention coating and packed in individual sleeve printed with graphically illustrated text for correct blade selection.</p> <p>Will fit most makes of bowsaw frame.</p></div></div>","<p>Brand: Bahco</p><p>Category: Bowsaws</p><p>Height (mm): 948</p><p>Width (mm): 2</p><p>Depth (mm): 35</p><p>Weight: 0.08</p>","<img src=""https://shared1.ad-lister.co.uk/UserImages/fad77979-26e2-4ede-9f39-bdb242f0c51d/Img/_brandlogos/Bahco_brandlogo.jpg""><br>","<img src=""https://shared1.ad-lister.co.uk/UserImages/fad77979-26e2-4ede-9f39-bdb242f0c51d/Img/_authdealerlogo/bahco_auth.jpg""><br>","","10 x Bahco 23-36 Raker Tooth Hard Point Bowsaw Blades 900mm (36in)  Bahco Raker Tooth Hard Point Bowsaw Blade are ideal for cutting in green wood. Made from hardened and tempered high quality steel with high frequency, induction hardened peg toothing.  They have been treated with a rust prevention coating and packed in individual sleeve printed with graphically illustrated text for correct blade selection.  Will fit most makes of bowsaw frame.","https://i.ebayimg.com/00/s/MTYwMFgxNjAw/z/WPkAAOSwub1l3H8j/$_10.JPG?set_id=2","","","","","","","","","","","","","","","","","","","","","","","","0"
"736ea92f-6769-4925-b7e4-06eb182e3754","EINTESD36LI1","Einhell 4513501 TE-SD 3.6/1 Li Cordless Screwdriver 3.6V 1 x 1.5Ah Li-ion EINTESD36LI1","","38.13","","","","","","","36.22","","","","","","","","","","35.50","36.22","","","34.31","45.43","19.90","<div class='d1'><p>The Einhell TE-SD 3.6/1 Li Cordless Screwdriver has robust metal gearing for maximum durability. Bits can be changed quickly thanks to the 6.35mm (1/4in) magnetic bit holder. With an ergonomic design and soft grip handle for easy handling and working without tiring, even in prolonged use. For optimum operation in dark areas there is integrated LED lighting. The cordless screwdriver is always ready-for-use thanks to the lithium-ion technology without self-discharge.</p> <p>Supplied with: 1 x Set of 10 Bits, 1 x 3.6V 1500mAh Rechargeable Battery, 1 x Micro USB Charger and 1 x High-Quality Metal Storage Box.</p> <p>Specifications:</p> <p>Bit Holder: 6.35mm (1/4in).<br />No Load Speed: 180/min.<br />Max. Torque: 4.5Nm.<br />Charge Time: 3-5 hours.<br />Length: 185mm.<br />Weight: 358g.</p></d><div class='d2'></d><div class='d3'>Einhell</d><div class='d4'>A02</d><div class='d5'>B2078</d>","<p>Brand: Einhell</p><p>Category: Screwdrivers - Cordless</p><p>Height (mm): 60</p><p>Width (mm): 185</p><p>Depth (mm): 185</p><p>Weight: 0.844</p>","<img src=""https://shared1.ad-lister.co.uk/UserImages/fad77979-26e2-4ede-9f39-bdb242f0c51d/Img/_brandlogos/Einhell_brandlogo.jpg""><br>","","Power Tools > Cordless Screwdrivers, Impact Drivers & Wrenches > Screwdrivers - Cordless","","https://shared1.ad-lister.co.uk/UserImages/bc2f034c-0841-4fff-9e00-38e24b9d45e4/img/EINTESD36LI1.jpg","https://shared1.ad-lister.co.uk/UserImages/bc2f034c-0841-4fff-9e00-38e24b9d45e4/img/EINTESD36LI1_A.JPG","https://shared1.ad-lister.co.uk/UserImages/bc2f034c-0841-4fff-9e00-38e24b9d45e4/img/EINTESD36LI1_INUSE1.JPG","https://shared1.ad-lister.co.uk/UserImages/bc2f034c-0841-4fff-9e00-38e24b9d45e4/img/EINTESD36LI1_PACKSHOT.JPG","","","","","","","","","","","","","","","","","","","","","0"
"d9dd0e26-0c93-479c-9ee5-0d57c7f91dc0","4326180","Einhell TE-AP 950 E All Purpose Reciprocating Saw Recip 240V 950W + KWB Blade","Includes Wood Cutting KWB Blade","78.99","","","","","","","74.99","","","","","","","","","","74.99","74.99","","","69.99","97.80","","<div>The Einhell TE-AP 950 E universal saw is designed for high-precision cutting results on wood, plastic and metal.<br>A powerful 950 W rating and electronic stroke speed control enable the tool to be adjusted to each particular material and application.<br>The tool can therefore be perfectly adjusted to different materials, material thicknesses and jobs.<br>The cutting depth in wood is 0.2 m and in steel 0.02 m.<br>The soleplate can be adjusted without any tools to make optimum use of the blade.<br>The saw blade can be changed quickly without the need for any tools.<br>The universal saw lies comfortably in the hand thanks to the large soft grip area, which makes it comfortable and above all safe to work with.<br>It was developed with an ergonomic and slimline design in mind to make it easy to handle.<br><br>The product is supplied complete with a KWB quality saw blade for wood.</div><div><strong>&nbsp;</strong></div><div><strong>Features&nbsp;</strong><br><br>Electronic stroke speed control for adjusting to application<br>Soleplate adjustable without tools for optimum blade use<br>Blade change without tools<br>Large soft grip area for comfortable and safe operation<br>Ergonomic, slim design for easy handling</div>","<div><strong>Specifications For 4326180&nbsp;</strong><br><br>Cutting depth steel - 20 mm<br>Cutting depth wood - 200 mm<br>Idle speed max - 2500 min^-1<br>Lift height - 28 mm<br>Power - 950 W<br>Product weight - 3.2 Kg<br>Saw blade support max - 1.5 mm<br>Saw blade support min - 0.8 mm</div><div>&nbsp;</div><div><br></div>","<br><img src=""https://shared1.ad-lister.co.uk/UserImages/fad77979-26e2-4ede-9f39-bdb242f0c51d/Img/_brandlogos/einhell_brandlogo.jpg""><br>","<img src=""https://shared1.ad-lister.co.uk/UserImages/fad77979-26e2-4ede-9f39-bdb242f0c51d/Img/_authdealerlogo/einhell_auth.jpg""><br>","","Desciption For 4326180   Electronic stroke speed control for adjusting to application Soleplate adjustable without tools for optimum blade use Blade change without tools Large soft grip area for comfortable and safe operation Ergonomic, slim design for easy handling ​     ​ ​ ","https://shared1.ad-lister.co.uk/UserImages/fad77979-26e2-4ede-9f39-bdb242f0c51d/Img/2024_02/4326180-MAIN.jpg","https://shared1.ad-lister.co.uk/UserImages/fad77979-26e2-4ede-9f39-bdb242f0c51d/Img/cordless rec/4326180.jpg","https://shared1.ad-lister.co.uk/UserImages/fad77979-26e2-4ede-9f39-bdb242f0c51d/Img/2024_02/4326180-1.jpg","https://shared1.ad-lister.co.uk/UserImages/fad77979-26e2-4ede-9f39-bdb242f0c51d/Img/cordless rec/4326180-2.jpg","https://shared1.ad-lister.co.uk/UserImages/fad77979-26e2-4ede-9f39-bdb242f0c51d/Img/cordless rec/4326180-3.jpg","https://shared1.ad-lister.co.uk/UserImages/fad77979-26e2-4ede-9f39-bdb242f0c51d/Img/cordless rec/4326180-4.jpg","https://shared1.ad-lister.co.uk/UserImages/fad77979-26e2-4ede-9f39-bdb242f0c51d/Img/cordless rec/49576105-1.jpg","https://shared1.ad-lister.co.uk/UserImages/fad77979-26e2-4ede-9f39-bdb242f0c51d/Img/cordless rec/4326180-1.jpg","https://shared1.ad-lister.co.uk/UserImages/fad77979-26e2-4ede-9f39-bdb242f0c51d/Img/cordless rec/49576105-2.jpg","https://shared1.ad-lister.co.uk/UserImages/fad77979-26e2-4ede-9f39-bdb242f0c51d/Img/cordless rec/49576105-3.jpg","https://shared1.ad-lister.co.uk/UserImages/fad77979-26e2-4ede-9f39-bdb242f0c51d/Img/2024_02/4326180-12.jpg","https://shared1.ad-lister.co.uk/UserImages/fad77979-26e2-4ede-9f39-bdb242f0c51d/Img/2024_02/4326180-11.jpg","https://shared1.ad-lister.co.uk/UserImages/fad77979-26e2-4ede-9f39-bdb242f0c51d/Img/2024_02/4326180-10.jpg","https://shared1.ad-lister.co.uk/UserImages/fad77979-26e2-4ede-9f39-bdb242f0c51d/Img/2024_02/4326180-9.jpg","","","","","","","","","","","0"
"1082684b-567d-4062-b5de-0de6c87e19d2","4460640-ACC","Einhell TC-OS 1520 1/3 Sheet Orbital Sander 150W 240V 230 x 93mm + Sanding Sheet","Includes 18 Sanding Sheets 5 x 60, 8 x 120 and 5 x 180","34.99","","","","","","","32.99","","","","","","","","","","32.99","32.99","","","29.99","39.50","","<div><strong>Desciption For 4460640</strong><br><br>The Einhell TC-OS 1520 Orbital Sander is a high-quality, handy device that provides an even sanding finish. Fitted with a clamping device as well as a hook and loop fastener system making the abrasive pad selectable and changed easily and quickly. Because of its large, ergonomic gripping sections, it can be handled precisely to receive perfect sanding results. The practical vacuum adaptor allows direct connection of a vacuum cleaner for extraction of sanding dust.&nbsp;&nbsp;<br>Input Power: 150W<br>Oscillating Speed: 23,000/min.<br>Oscillating Circuit: 2mm<br>Base Size: 230 x 93mm<br>Weight: 1.1kg</div><div>&nbsp;</div><div><strong>Desciption For 49817985</strong><br><br>With the practical sanding strip set, large surfaces made of wood or metal can be processed quickly, precisely and cleanly. Thanks to perforation, the strips are suitable for use with a suction device. The Quick-Stick system allows tool-free change. Due to different grains, the right abrasive is available for every project. The sanding strips are suitable for all standard orbital sanders with Velcro backing plate. All sanding strips of the set have the dimensions 93 x 187 mm and an underlay made of e-paper with Velcro backing. Furthermore, the strips are two times fully resin-bonded. The abrasive is made of fine corundum and the strips are punched 8 holes (diameter 10 mm). </div><div>&nbsp;</div><div>The set contains 18 strips with three different grits, 5 x 60, 8 x 120 and 5 x 180 <br><div><br></div></div><div>&nbsp;</div><div>&nbsp;</div><div><br></div>","<div><strong>Specifications For 4460640</strong><br><br>Voltage:240V<br>Brand:Einhell<br>Category:Orbital Sanders 1/3 Sheet<br>Height:278<br>Width:107<br>Depth:159<br>Weight:1.644<br>MPN:4460642</div><div>&nbsp;</div><div><strong>Specifications For 49817985</strong><br><br>Manufacturer - ‎kwb by Einhell<br>Part Number - ‎49817985<br>Product Dimensions - ‎18.7 x 9.3 x 0.25 cm; 240 Grams<br>Item model number - ‎49817985<br>Size - 18.7 x 9.3 x 0.25 cm<br>Material - ‎Resin<br>Item Package Quantity - ‎1<br>Grit Number - 120<br>Grit Description - ‎Fine<br>Included Components - ‎x5 60 sandpaper, x5 120 sandpaper, x5 180 sandpaper.<br>Item Weight - 240 g</div>","<img src=""https://shared1.ad-lister.co.uk/UserImages/fad77979-26e2-4ede-9f39-bdb242f0c51d/Img/_brandlogos/einhell_brandlogo.jpg""><br>","<img src=""https://shared1.ad-lister.co.uk/UserImages/fad77979-26e2-4ede-9f39-bdb242f0c51d/Img/_authdealerlogo/einhell_auth.jpg""><br>","","Desciption For 4460640 The Einhell TC-OS 1520 Orbital Sander is a high-quality, handy device that provides an even sanding finish. Fitted with a clamping device as well as a hook and loop fastener system making the abrasive pad selectable and changed easily and quickly. Because of its large, ergonomic gripping sections, it can be handled precisely to receive perfect sanding results. The practical vacuum adaptor allows direct connection of a vacuum cleaner for extraction of sanding dust.  Input Power: 150W Oscillating Speed: 23,000/min. Oscillating Circuit: 2mm Base Size: 230 x 93mm Weight: 1.1kg  Desciption For 49817985 With the practical sanding strip set, large surfaces made of wood or metal can be processed quickly, precisely and cleanly. Thanks to perforation, the strips are ","https://shared1.ad-lister.co.uk/UserImages/fad77979-26e2-4ede-9f39-bdb242f0c51d/Img/2024_02/4460640-ACC-MAIN.jpg","https://shared1.ad-lister.co.uk/UserImages/fad77979-26e2-4ede-9f39-bdb242f0c51d/Img/2024_02/4460640-1.jpg","https://shared1.ad-lister.co.uk/UserImages/fad77979-26e2-4ede-9f39-bdb242f0c51d/Img/corded sande/49817985.jpg","https://shared1.ad-lister.co.uk/UserImages/fad77979-26e2-4ede-9f39-bdb242f0c51d/Img/2024_02/4460640-8.png","https://shared1.ad-lister.co.uk/UserImages/fad77979-26e2-4ede-9f39-bdb242f0c51d/Img/2024_02/4460640-12.png","https://shared1.ad-lister.co.uk/UserImages/fad77979-26e2-4ede-9f39-bdb242f0c51d/Img/2024_02/4460640-10.png","https://shared1.ad-lister.co.uk/UserImages/fad77979-26e2-4ede-9f39-bdb242f0c51d/Img/2024_02/4460640-9.png","https://shared1.ad-lister.co.uk/UserImages/fad77979-26e2-4ede-9f39-bdb242f0c51d/Img/2024_02/4460640-7.jpg","https://shared1.ad-lister.co.uk/UserImages/fad77979-26e2-4ede-9f39-bdb242f0c51d/Img/2024_02/44606406.jpg","https://shared1.ad-lister.co.uk/UserImages/fad77979-26e2-4ede-9f39-bdb242f0c51d/Img/2024_02/4460640-5.jpg","https://shared1.ad-lister.co.uk/UserImages/fad77979-26e2-4ede-9f39-bdb242f0c51d/Img/2024_02/4460640-4.jpg","https://shared1.ad-lister.co.uk/UserImages/fad77979-26e2-4ede-9f39-bdb242f0c51d/Img/2024_02/4460640-3.jpg","https://shared1.ad-lister.co.uk/UserImages/fad77979-26e2-4ede-9f39-bdb242f0c51d/Img/2024_02/4460640-2.jpg","https://stbapmedia.blob.core.windows.net/imagessource/website_images/eintcos1520-main.jpg","https://shared1.ad-lister.co.uk/UserImages/fad77979-26e2-4ede-9f39-bdb242f0c51d/Img/2024_02/4460640-11.png","https://shared1.ad-lister.co.uk/UserImages/fad77979-26e2-4ede-9f39-bdb242f0c51d/Img/corded sande/49817985-1.jpg","","","","","","","","","19"
"fd72cbb6-551d-48f3-b453-143d1a8da3c2","ZAR100302","Zarges 100302 Hop-Up Work Platform 600 x 300mm ZAR100302","","85.14","","","","","","","77.65","","","","","","","","","","75.92","77.65","","","76.50","96.00","48.00","<div class='d1'><p>This Zarges Hop-Up Work Platform has the following specification:</p> <p>Platform Length: 600mm.<br />Platform Width: 300mm.<br />Coating: Natural.<br />Load Capacity: 150kg.<br />Material: Aluminium.<br />Platform Height: 0.47m.<br />Working Height: 2.47m.<br />Warranty: 10 Years.</p></d><div class='d2'><p>The Zarges Hop-Up Work Platform&nbsp;offers a convenient and safe way to reach low level heights, ideal for decorating or low level maintenance tasks. It has a has a large platformfor safe and comfortable working. Fitted with slip-resistant plastic end caps for increased stability.&nbsp;Folds to extremely small dimensions for transport and storage.</p> <p>Specifications:</p> <p>Coating: Natural.<br />Load Capacity: 150kg.<br />Material: Aluminium.<br />Platform Height: 0.47m.<br />Working Height: 2.47m.<br />Warranty: 10 Years.</p></d><div class='d3'>Zarges</d><div class='d4'>A16</d><div class='d5'>B2011</d>","<p>Brand: Zarges</p><p>Category: Hop Ups</p><p>Height (mm): 700</p><p>Width (mm): 180</p><p>Depth (mm): 350</p><p>Weight: 5.0</p>","<img src=""https://shared1.ad-lister.co.uk/UserImages/fad77979-26e2-4ede-9f39-bdb242f0c51d/Img/_brandlogos/Zarges_brandlogo.jpg""><br>","","Ladders & Other Access Equipment > Stepladders & Platform Steps > Hop Ups","","https://shared1.ad-lister.co.uk/UserImages/bc2f034c-0841-4fff-9e00-38e24b9d45e4/img/ZAR100302.jpg","","","","","","","","","","","","","","","","","","","","","","","","1"
