"a2a2ea78-8961-487c-b044-6d0409e4c8f7","BSH6112A4060","Bosch 06112A4060 GBH 2-26 F Professional SDS Plus Rotary Hammer 830W 110V BSH6112A4060","","234.68","","","","","","","209.66","","","","","","","","","","206.33","209.66","","","204.66","210.13","139.00","<div class='d1'><p>Bosch GBH 2-26 F Professional SDS Plus Rotary Hammer 110V Version.</p></d><div class='d2'><p>The Bosch GBH 2-26 F Professional SDS Plus Rotary Hammer is suitable for a wide range of applications: drilling, hammer drilling and chiselling. It has a reliable and robust design with a long lifetime due to high-quality components. With an improved performance for a fast drilling rate and high chiselling removal rate. Supplied with a quick-change chuck for fast changes between drilling with impact in concrete and drilling without impact in wood and metal.</p> <p>The rotating brush plate provides equal power in forward and reverse rotation, meaning you can dislodge jammed drill bits. Continuously variable speed control allows for clean drilling starts and there is a locking button for continuous and fatigue-free work. There is also an overload clutch to protect the user and the machine and a ball grommet for preventing cable breaks.</p> <p>Supplied with: 1 x Quick Change Chuck 13mm, 1 x SDS Plus Quick-change Chuck, 1 x Auxiliary Handle, 1 x Depth Stop 210mm, 1 x Machine Cloth and 1 x Carrying Case.</p> <p>Specifications:</p> <p>Input Power: 830W.<br />No Load Speed: 0-900/min.<br />Impact Rate: 0&ndash;4,000/bpm.<br />Impact Energy: 2.7 Joules.<br />Drilling Diameter: Concrete, Hammer Drill Bits&nbsp;4-26mm,&nbsp;Concrete with Core Cutters&nbsp;16-68mm,&nbsp;Metal&nbsp;13mm,&nbsp;Wood&nbsp;30mm.<br />Weight:&nbsp;2.9kg.</p></d><div class='d3'>Bosch</d><div class='d4'>A02</d><div class='d5'>B0101</d>","<p>Brand: Bosch</p><p>Category: SDS Plus Hammer Drills</p><p>Height (mm): 118</p><p>Width (mm): 443</p><p>Depth (mm): 362</p><p>Weight: 5.27</p>","<img src=""https://shared1.ad-lister.co.uk/UserImages/fad77979-26e2-4ede-9f39-bdb242f0c51d/Img/_brandlogos/Bosch_brandlogo.jpg""><br>","","Power Tools > Drills - SDS & Hammer > SDS Plus Hammer Drills","","https://shared1.ad-lister.co.uk/UserImages/bc2f034c-0841-4fff-9e00-38e24b9d45e4/img/BSH6112A4070.jpg","","","","","","","","","","","","","","","","","","","","","","","","1"
"6fe1538b-9d57-46e6-9526-732a92cec7a0","SG14","Sealey SG14 Underbody Coating Gun Air Operated","","0.00","","","","","","","16.95","","","","","","","","","","16.95","16.95","","","14.95","24.95","21.80","<div>Professional coating gun suitable for automotive and general industrial applications.</div><div>Accepts most popular types of 1L coating tin. </div><div>Supplied with extended flexible nozzle for wax spraying cavities. </div><div>&nbsp;</div><div>Air Inlet Size: 1/4""BSP.</div><div>Air Supply: 90psi(8cfm).<br><br>Air Consumption:<span style=""white-space:pre"">	</span>8cfm<br>Air Inlet Size:<span style=""white-space:pre"">	</span>1/4""BSP<br>Nett Weight:<span style=""white-space:pre"">	</span>0.48kg<br>Recommended Air Pressure:<span style=""white-space:pre"">	</span>90psi<br></div><br>","<b>Specifications of the Sealey SG14</b><br><br><div>Air Inlet Size: 1/4""BSP.</div><div>Air Supply: 90psi(8cfm).<br><br>Air Consumption:<span style=""white-space: pre;"">	</span>8cfm<br>Air Inlet Size:<span style=""white-space: pre;"">	</span>1/4""BSP<br>Nett Weight:<span style=""white-space: pre;"">	</span>0.48kg<br>Recommended Air Pressure:<span style=""white-space: pre;"">	</span>90psi</div>","<img src=""https://shared1.ad-lister.co.uk/UserImages/fad77979-26e2-4ede-9f39-bdb242f0c51d/Img/_brandlogos/sealey_brandlogo.jpg""><br>","<img src=""https://shared1.ad-lister.co.uk/UserImages/fad77979-26e2-4ede-9f39-bdb242f0c51d/Img/_authdealerlogo/sealey_auth.jpg""><br>","","To convert to gas, just order a reel of regular wire. tips, a bottle of gas and a conversion kit. The kit contains mini regulator plus gas connection hose (Model No. 120.802032) for welders PMG110 to PMG155XT. PMG100 cannot be converted to welding with gas.","https://shared1.ad-lister.co.uk/UserImages/fad77979-26e2-4ede-9f39-bdb242f0c51d/Img/2024_02/SG14-1.jpg","https://shared1.ad-lister.co.uk/UserImages/fad77979-26e2-4ede-9f39-bdb242f0c51d/Img/2024_02/SG14.jpg","","","","","","","","","","","","","","","","","","","","","","","6"
"b8f61da5-6995-4714-88a2-73e04a2701e0","CWCOND01","Salamander Catalytic Water Conditioner 1/2"" BSP Single Point 0-15 L/min CWCOND01","","124.95","359.92","","","","","","114.95","","","","","","","","","","114.95","114.95","","","109.95","162.51","","<div>Salamander Pumps Water Conditioners offer single point or whole house water supply treatment, they prevent limescale build-up, protecting your household appliances including a shower pump.</div><div><br>Salamander Catalytic Water Conditioners use an alloy core which changes the Calcium Carbonate from Calcite to Aragonite, there are no chemicals or salt in this process meaning that the water is also safe to drink.<br><br><strong>Key Features</strong><br>Single point or whole house water supply treatment,<br>Prevent limescale build-up,<br>Do not use chemicals or salt,<br>Easy to install in any orientation,<br>Compact design,<br>Environmentally friendly,<br>Maintenance free – no ongoing running costs,<br>No electrical power required,<br>10-year warranty, with an average lifespan of 15 years.<br>&nbsp;<br><br>The Single Point Water Conditioner comes with a parallel alloy core together with ½” male parallel thread at one end and a ½” female parallel thread at the other end making it simple to install to the following:<br><br>&gt;Shower Heads<br>&gt;Shower Mixing Valves<br>&gt;Electric showers<br>&gt;Instant Water Heaters<br>&gt;Washing Machines<br>&gt;Dishwashers<br><br>The unique design of the parallel alloy core allows the installer to fit the Single Point Water Conditioner in any orientation. The Single Point Water Conditioner requires flow rates of 1 to 15 L/min to operate correctly.<br>&nbsp;<br><div><br></div></div>","Weight - 0.1 kg<br>Size - 80mm x 20mm<br>SKU - CWCOND01<br>Connection Size - 1/2"" BSP-P suitable for 0-15 L/min<br>Flow Range L/Min - 0-15 L/Min<br>Supplied Fittings - N/A<br><div><br></div>","<img src=""https://shared1.ad-lister.co.uk/UserImages/fad77979-26e2-4ede-9f39-bdb242f0c51d/Img/_brandlogos/salamander_brandlogo.jpg""><br><br><br><br><br>","<img src=""https://shared1.ad-lister.co.uk/UserImages/fad77979-26e2-4ede-9f39-bdb242f0c51d/Img/_authdealerlogo/salamander_authdealer.jpg""><br><br>","","Salamander Pumps Water Conditioners offer single point or whole house water supply treatment, they prevent limescale build-up, protecting your household appliances including a shower pump. Salamander Catalytic Water Conditioners use an alloy core which changes the Calcium Carbonate from Calcite to Aragonite, there are no chemicals or salt in this process meaning that the water is also safe to drink.  Key Features Single point or whole house water supply treatment, Prevent limescale build-up, Do not use chemicals or salt, Easy to install in any orientation, Compact design, Environmentally friendly, Maintenance free – no ongoing running costs, No electrical power required, 10-year warranty, with an average lifespan of 15 years.    The Single Point Water Conditioner comes with a parallel alloy core together with ½” male parallel thread at one end and a ½” female parallel thread at the other end making it simple to install to the following:  Shower Heads Shower Mixing Valves Electric showers Instant Water Heaters Washing Machines Dishwashers  The unique design of the parallel alloy core allows the installer to fit the Single Point Water Conditioner in any orientation. The Single Point Water Conditioner requires flow rates of 1 to 15 L/min to operate correctly.   ","https://shared1.ad-lister.co.uk/UserImages/fad77979-26e2-4ede-9f39-bdb242f0c51d/Img/conditioners/CWCOND01.jpg","https://shared1.ad-lister.co.uk/UserImages/fad77979-26e2-4ede-9f39-bdb242f0c51d/Img/conditioners/CWCOND01_info.jpg","","","","","","","","","","","","","","","","","","","","","","","1"
"bf56d277-031e-4def-a001-788676caff52","K/S70100499","Kent & Stowe 70100499 Large Topiary Shears K/S70100499","","13.53","","","","","","","12.88","","","","","","","","","","12.56","12.88","","","12.36","13.67","5.39","<div class='d1'><p>These Kent &amp; Stowe Topiary Shears are for the training of perennial foliage, buxus, shrubs and trees into desired shapes and forms. Also for trimming and shaping of holly and yew. They have non-slip handles, designed for efficient, single-handed use. With smooth carbon steel blades for fast and fine cutting, trimming and shaping.<br /><br />These Kent &amp; Stowe Large Topiary Shears are suitable for the gardeners with larger hands or those facing larger tasks.</p></d><div class='d2'></d><div class='d3'>Kent & Stowe</d><div class='d4'>A03</d><div class='d5'>B0043</d>","<p>Brand: Kent & Stowe</p><p>Category: Secateurs - Bypass</p><p>Height (mm): 370</p><p>Width (mm): 25</p><p>Depth (mm): 90</p><p>Weight: 0.275</p>","<img src=""https://shared1.ad-lister.co.uk/UserImages/fad77979-26e2-4ede-9f39-bdb242f0c51d/Img/_brandlogos/Kent & Stowe_brandlogo.jpg""><br>","","Garden Tools > Pruning > Secateurs - Bypass","","https://shared1.ad-lister.co.uk/UserImages/bc2f034c-0841-4fff-9e00-38e24b9d45e4/img/K-S70100499.jpg","","","","","","","","","","","","","","","","","","","","","","","","1"
"16260461-a1ce-4137-9842-7926322b57bb","5445139000-2BATT","Einhell Power X-Change HEROCCO 18/20 18v Brushless Rotary Hammer Kit - 2x 4.0Ah","Includes Medium E-Box Carry Case","0.00","","","","","","","155.99","","","","","","","","","","155.99","155.99","","","152.99","199.99","","<div>The Einhell HEROCCO 18/20 Kit Cordless Rotary Hammer delivers more power and provides longer operation times thanks to the brushless motor. Drilling, hammer drilling or chiselling with or without lock make it a valued allrounder. <br><br>The pneumatic impact mechanism makes effortless progress through concrete. Tools can be changed quickly thanks to the universal SDS-plus tool chuck with auto-slip-in function. The ergonomic grip area provides a firm soft grip hold. The LED light illuminates the work area. <br><br>Includes 1x magnetic bit adapter, a storage case (E-Box) and 2x 18V 4.0Ah Einhell Power X-Change rechargeable battery and charger.</div><div>&nbsp;</div><div><strong>Features</strong></div><div>&nbsp;</div><div>4+1 functions: Drilling/impact drilling/chiseling with &amp; without lock<br>Pneumatic impact drilling in concrete (20mm)<br>Max. torque: 18Nm<br>Impact rate: 2.2J<br>Vibration-cushioned handle</div><div><br><strong>Includes&nbsp;</strong></div><div><strong>&nbsp;</strong><br>2X 4.0AH Batteries&nbsp;<br>1X magnetic bit adapter and a transport and storage case (E-Box)<br>1X Fast Charger</div>","<div>Brand: Einhell<br>Manufacturer ID: 5445139000<br>Warranty (years): 2</div><div>Max. torque: 18Nm<br>Impact rate: 2.2J<br><br>Pack contents<span style=""white-space:pre"">	</span>1 x cordless rotary hammer, 2 x 4.0Ah lithium ion batteries, 1 x magnetic bit adapter, 1 x transport and storage case (E-Box)</div><br>","<br><img src=""https://shared1.ad-lister.co.uk/UserImages/fad77979-26e2-4ede-9f39-bdb242f0c51d/Img/_brandlogos/einhell_brandlogo.jpg""><br>","<img src=""https://shared1.ad-lister.co.uk/UserImages/fad77979-26e2-4ede-9f39-bdb242f0c51d/Img/_authdealerlogo/einhell_auth.jpg""><br>","","The Einhell HEROCCO 18/20 Kit Cordless Rotary Hammer delivers more power and provides longer operation times thanks to the brushless motor. Drilling, hammer drilling or chiselling with or without lock make it a valued allrounder.  The pneumatic impact mechanism makes effortless progress through concrete. Tools can be changed quickly thanks to the universal SDS-plus tool chuck with auto-slip-in function. The ergonomic grip area provides a firm soft grip hold. The LED light illuminates the work area.  Includes 1x magnetic bit adapter, a storage case (E-Box) and 1x 18V 4.0Ah Einhell Power X-Change rechargeable battery and charger.  Features  4+1 functions: Drilling/impact drilling/chiseling with without lock Pneumatic impact drilling in concrete (20mm) Max. torque: ...","https://shared1.ad-lister.co.uk/UserImages/fad77979-26e2-4ede-9f39-bdb242f0c51d/Img/2024_02/5445139000-2BATT.jpg","https://shared1.ad-lister.co.uk/UserImages/fad77979-26e2-4ede-9f39-bdb242f0c51d/Img/corded percu/5445139000-1.jpg","https://shared1.ad-lister.co.uk/UserImages/fad77979-26e2-4ede-9f39-bdb242f0c51d/Img/2024_02/5445139000-6.jpg","https://shared1.ad-lister.co.uk/UserImages/fad77979-26e2-4ede-9f39-bdb242f0c51d/Img/2024_02/5445139000-5.jpg","https://shared1.ad-lister.co.uk/UserImages/fad77979-26e2-4ede-9f39-bdb242f0c51d/Img/2024_02/5445139000-4.jpg","https://shared1.ad-lister.co.uk/UserImages/fad77979-26e2-4ede-9f39-bdb242f0c51d/Img/2024_02/5445139000-3.jpg","https://shared1.ad-lister.co.uk/UserImages/fad77979-26e2-4ede-9f39-bdb242f0c51d/Img/2024_02/5445139000-2.jpg","https://shared1.ad-lister.co.uk/UserImages/fad77979-26e2-4ede-9f39-bdb242f0c51d/Img/2024_02/5445139000-1.jpg","https://shared1.ad-lister.co.uk/UserImages/fad77979-26e2-4ede-9f39-bdb242f0c51d/Img/corded percu/Einhell-fast-charger-and-4a.jpg","https://shared1.ad-lister.co.uk/UserImages/fad77979-26e2-4ede-9f39-bdb242f0c51d/Img/corded percu/4511396.jpg","https://shared1.ad-lister.co.uk/UserImages/fad77979-26e2-4ede-9f39-bdb242f0c51d/Img/corded percu/einhell-fast-charger.jpg","","","","","","","","","","","","","","10"
"d23a15e8-db6a-4c08-8245-7a230de542b8","2347140-1-4AH","Einhell 18v Power X-Change Cordless Wet And Dry Vacuum Cleaner TE-VC + 4AH Kit","Includes Full Accessory Set ","228.17","","","","","","","211.15","","","","","","","","","","211.15","211.15","","","202.10","224.90","","<div><strong>Desciption For 2347140&nbsp;</strong><br><br>The Einhell TE-VC 36/30 Li S-Solo cordless wet and dry vacuum cleaner is a member of the Power X-Change family. For optimal use of the battery there are two speeds: ECO and BOOST. Both the 30 l stainless steel tank and the stainless steel telescopic tube (Ã˜ 36 mm) are robust in design. The accessory holder for neat storage and water drain screw make it a practical product to use. The blow connection is for blow-cleaning hard-to-reach areas. Easy transportation is ensured by the large wheels and castors. The product is supplied with a heavy-duty plastic suction hose (Ã˜ 36 mm, 2.5 m length) and a large combination nozzle for carpets and smooth flooring. <br><br>Member of the Power X-Change family, 2x18V batteries necessary<br>2 speeds (ECO/BOOST) for optimal battery use<br>High suction power with simultaneous cordless freedom<br>30l stainless steel tank, rust-proof and sturdy<br>Blow connection for blow-cleaning hard-to-reach areas<br>Large wheels and castors for easy transporting<br>Practical accessories holder for clean stowage and operations</div><div><strong>&nbsp;</strong></div><div><strong>Desciption For 4511396&nbsp;<br><br></strong>Einhell Power X Change 18v Lithium Ion 4.0ah Battery<br><br>Power X-Change is the rechargeable battery system from Einhell. It is designed for multi functionality. With this advanced technology, you can use 18V rechargeable batteries with different capacity ratings to power any of the Einhell Power X Change range.<br><br>7-in-1 ABS: Active Battery Management System from Einhell.<br><br>No memory effect - the battery can be recharged at any time, even if it is only partially discharged.<br><br>No self discharging - always ready for immediate action even after being in storage for months.<br><br>Compact and light - significantly lighter than NiCd batteries allowing better handling.<br><br>Sophisticated charging technology - short charging time, optimum performance and maximum battery life.<br><br>Consistently high performance - delivers almost the same power at the end of the battery life as freshly charged ones.<br><br>3 x running time - compared to the conventional NiCd batteries.<br><br>3-step LED battery control.<br><br>Modern technology: Microprocessor controls permanently parameters.<br><br>Rubber-coated housing makes sure high impact protection and grip.</div><div><strong>&nbsp;</strong></div><div><strong>Desciption For 4514095&nbsp;</strong><br><br>18v 30 minute Power X-Change Charger for 1.5 Ah - 5.2Ah batteries<br><br>6-steps charging condition display with charging light indicator.<br><br>Ready for wall-fastening. Intelligent Charging-Management-System for long battery life.<br><br>Battery status will be constantly checked an accordant loaded.<br><br>Deeply discharged batteries will be charged in repair mode.<br><br>Fully compatible with both the 1.5Ah and 3.0Ah.<br><br>60 min Charge for 18v/3.0Ah Lithium Battery<br><br>30 min Charge for 18v/1.5Ah Lithium Battery</div>","<div><strong>Specifications For 2347140&nbsp;</strong><br><br>Suction power max.: 150 mbar<br>Vessel capacity: 30 L<br>Suction hose length: 250 cm<br>Suction hose diameter: 36 mm<br>Sound pressure level Lpa: 76 dB (A)<br><br>Weight: 11.71kg<br>Height: 635mm<br>Length: 463mm<br>Width: 385mm<br>EAN: 4006825635874</div><div><strong>&nbsp;</strong></div><div><strong>Specifications For 4511396&nbsp;</strong><br><br>Voltage: 18V.<br>Battery Type: Lithium-Ion.<br>Power: 4.0 Amp Hours.<br>Charge time: 80 Minutes.<br>EAN: 4006825610376</div><div>&nbsp;</div><div><strong>Specifications For 4514095&nbsp;</strong><br><br>Mains supply charger: 200-250 V | 50-60 Hz<br>Voltage output charger: 20 V<br>Charging time: 50min<br>Voltage: 18 V<br>Charging current 3.0 Ah<br>EAN: 4006825655292<br><div><br></div></div>","<img src=""https://shared1.ad-lister.co.uk/UserImages/fad77979-26e2-4ede-9f39-bdb242f0c51d/Img/_brandlogos/einhell_brandlogo.jpg"">","<img src=""https://shared1.ad-lister.co.uk/UserImages/fad77979-26e2-4ede-9f39-bdb242f0c51d/Img/_authdealerlogo/einhell_auth.jpg"">","","Desciption For 2347140   The Einhell TE-VC 36/30 Li S-Solo cordless wet and dry vacuum cleaner is a member of the Power X-Change family. For optimal use of the battery there are two speeds: ECO and BOOST. Both the 30 l stainless steel tank and the stainless steel telescopic tube (Ã˜ 36 mm) are robust in design. The accessory holder for neat storage and water drain screw make it a practical product to use. The blow connection is for blow-cleaning hard-to-reach areas. Easy transportation is ensured by the large wheels and castors. The product is supplied with a heavy-duty plastic suction hose (Ã˜ 36 mm, 2.5 m length) and a large combination nozzle for carpets and smooth flooring.  Member of the Power X-Change family, 2x18V batteries necessary 2 speeds (ECO/BOOST) for optimal battery use High suction power with simultaneous cordless freedom 30l stainless steel tank, rust-proof and sturdy Blow connection for blow-cleaning hard-to-reach areas Large wheels and castors for easy transporting Practical accessories holder for clean stowage and operations ​ Desciption For 4511396   Einhell Power X Change 18v Lithium Ion 4.0ah Battery  Power X-Change is the rechargeable battery system from Einhell. It is designed for multi functionality. With this advanced technology, you can use 18V rechargeable batteries with different capacity ratings to power any of the Einhell Power X Change range.  7-in-1 ABS: Active Battery Management System from Einhell.  No memory effect - the battery can be recharged at any time, even if it is only partially discharged.  No self discharging - always ready for immediate action even after being in storage for months.  Compact and light - significantly lighter than NiCd batteries allowing better handling.  Sophisticated charging technology - short charging time, optimum performance and maximum battery life.  Consistently high performance - delivers almost the same power at the end of the battery life as freshly charged ones.  3 x running time - compared to the conventional NiCd batteries.  3-step LED battery control.  Modern technology: Microprocessor controls permanently parameters.  Rubber-coated housing makes sure high impact protection and grip. ​ Desciption For 4514095   18v 30 minute Power X-Change Charger for 1.5 Ah - 5.2Ah batteries  6-steps charging condition display with charging light indicator.  Ready for wall-fastening. Intelligent Charging-Management-System for long battery life.  Battery status will be constantly checked an accordant loaded.  Deeply discharged batteries will be charged in repair mode.  Fully compatible with both the 1.5Ah and 3.0Ah.  60 min Charge for 18v/3.0Ah Lithium Battery  30 min Charge for 18v/1.5Ah Lithium Battery","https://shared1.ad-lister.co.uk/UserImages/fad77979-26e2-4ede-9f39-bdb242f0c51d/Img/cordless vac/2347140-1-4AH.jpg","https://stbapmedia.blob.core.windows.net/imagessource/2024_einhell/2347140_21021_001 Main Image.jpg","https://shared1.ad-lister.co.uk/UserImages/fad77979-26e2-4ede-9f39-bdb242f0c51d/Img/cordless vac/4511396.jpg","https://shared1.ad-lister.co.uk/UserImages/fad77979-26e2-4ede-9f39-bdb242f0c51d/Img/cordless vac/4514095.jpg","https://shared1.ad-lister.co.uk/UserImages/fad77979-26e2-4ede-9f39-bdb242f0c51d/Img/2024_02/2347140-20.jpg","https://shared1.ad-lister.co.uk/UserImages/fad77979-26e2-4ede-9f39-bdb242f0c51d/Img/2024_02/2347140-19.jpg","https://shared1.ad-lister.co.uk/UserImages/fad77979-26e2-4ede-9f39-bdb242f0c51d/Img/2024_02/2347140-18.jpg","https://shared1.ad-lister.co.uk/UserImages/fad77979-26e2-4ede-9f39-bdb242f0c51d/Img/2024_02/2347140-17.jpg","https://shared1.ad-lister.co.uk/UserImages/fad77979-26e2-4ede-9f39-bdb242f0c51d/Img/2024_02/2347140-16.jpg","https://shared1.ad-lister.co.uk/UserImages/fad77979-26e2-4ede-9f39-bdb242f0c51d/Img/2024_02/2347140-15.jpg","https://shared1.ad-lister.co.uk/UserImages/fad77979-26e2-4ede-9f39-bdb242f0c51d/Img/2024_02/2347140-14.jpg","https://shared1.ad-lister.co.uk/UserImages/fad77979-26e2-4ede-9f39-bdb242f0c51d/Img/2024_02/2347140-13.jpg","https://shared1.ad-lister.co.uk/UserImages/fad77979-26e2-4ede-9f39-bdb242f0c51d/Img/2024_02/2347140-12.jpg","https://shared1.ad-lister.co.uk/UserImages/fad77979-26e2-4ede-9f39-bdb242f0c51d/Img/2024_02/2347140-11.jpg","https://shared1.ad-lister.co.uk/UserImages/fad77979-26e2-4ede-9f39-bdb242f0c51d/Img/2024_02/2347140-10.jpg","https://shared1.ad-lister.co.uk/UserImages/fad77979-26e2-4ede-9f39-bdb242f0c51d/Img/2024_02/2347140-9.jpg","https://shared1.ad-lister.co.uk/UserImages/fad77979-26e2-4ede-9f39-bdb242f0c51d/Img/2024_02/2347140-8.jpg","https://shared1.ad-lister.co.uk/UserImages/fad77979-26e2-4ede-9f39-bdb242f0c51d/Img/2024_02/2347140-7.jpg","https://shared1.ad-lister.co.uk/UserImages/fad77979-26e2-4ede-9f39-bdb242f0c51d/Img/2024_02/2347140-6.jpg","https://shared1.ad-lister.co.uk/UserImages/fad77979-26e2-4ede-9f39-bdb242f0c51d/Img/2024_02/2347140-5.jpg","https://shared1.ad-lister.co.uk/UserImages/fad77979-26e2-4ede-9f39-bdb242f0c51d/Img/2024_02/2347140-24.jpg","https://shared1.ad-lister.co.uk/UserImages/fad77979-26e2-4ede-9f39-bdb242f0c51d/Img/2024_02/2347140-25.jpg","https://shared1.ad-lister.co.uk/UserImages/fad77979-26e2-4ede-9f39-bdb242f0c51d/Img/2024_02/2347140-23.jpg","https://shared1.ad-lister.co.uk/UserImages/fad77979-26e2-4ede-9f39-bdb242f0c51d/Img/2024_02/2347140-21.jpg","1"
